"Professor here, if you have missed class, please come back. We aren’t mad at you.","Hello, I’ve read a lot of posts recently about folks missing classes and feeling too anxious to come back. Don’t worry. We would much rather you come back to our classes than continue to miss. We teach because we care about you individually. We care about what’s going on in your lives. I know it’s easy to see professors as these omnipresent overlords but know that we are human and we have definitely been in your position before. Please feel better and know that you are always welcome back into class. Just shoot us an email and let us know what’s up so we can help you make up the work you missed.
"
1. Anxiety makes it hard to go to sleep 2. Depression makes it hard to get out of bed 3. Drink coffee for a boost 4. Caffeine makes anxiety worse 5. Repeat,Just one of the hellish cycles that anxiety gets me caught in. Can anyone else relate?
How to order from subway?,I've been pretty much suffering from social anxiety all my life...but subway just gives me chills. I just can't never gather the guts to order from a subway. Can someone explain me how to place an order at subway without being judged?
"I was thinking why this sub has a lot more upvotes than comments, realized people are too anxious to comment,lol","edit: welp reaching over 2000 upvotes makes me anxious to post anything here again, so I guess this will be my only post :p"
"hey if you know someone has anxiety PLEASE DON'T TEXT THEM ""WE NEED TO TALK"" AND THEN NOT REPLY FOR 7 HOURS FUCK",just needed to get that out there
"I don't think people realize how much strength it takes to pull your own self out of a dark place mentally. So if you've done that today or any day, i'm proud of you.","EDIT: I heard the quote somewhere, doesn't belong to me. :)"
Anxiety is having a wonderful day ahead of you but not enjoying it because you’re thinking about that 2 minute phone call you’ll have to make in five days.,"Edit: sometimes I just feel so alone, sometimes more than 1.5k people relate to me. Thank you. "
Anxiety is waking up 3 hours before your alarm and not being able to fall back asleep because you're worried you won't be able to fall back asleep.,Thanks brain.
"I’m an italian OCD and anxiety sufferer, and I’m here to tell you that it’s going to be okay.","I know you probably don’t believe me, but it WILL get better and easier. I know it sounds scary when governments start to put out all of those limitations and lockdowns, but it’s for the better. 

If you’re starting quarantine or are obligated to stay home just like we are, I promise you’ll get used to it. And not used to it in a negative way! There are so many things you can do at home: I baked so many cakes, I’m trying to do the splits, I’m reading all the books I never got a chance to read. Isolation is reaaally not that bad.

We have the amazing power of adaptation. Every tool you have learned to cope with your anxiety will come in super handy, and you’ll see how strong you are with them. Sometimes I imagine COVID-19 as the boss level of anxiety, and it gets me super pumped lol. It makes me want to kick its ass so much.

It’s a wild ride but if us italians are riding it out, you’ll ride it out as well!
Sending you all a giant hug. We’re in this shit together.

And please, remember this pro tip: check what is necessary to check on the news. And that means check only what YOU as a citizen need to do. Numbers will go super high, then super low, then high and low again... it’s a pain that you really don’t need in your everyday life. If it’s impossible for you to resist the urge, have a trusted loved one tell you the necessary things you need to know: if there are new limitations, if you can go to school / work , what you should do with your hands etc.

EDIT: thank you so much for the awards, I really never thought this would blow up. There are so many comments, I’ll try my best to answer to the most. But as for all the compliments, THANK YOU!! You are all really sweet. You’ve joined the fight with us, you are not alone :)."
Anyone else more anxious about COVID restrictions being lifted than they were about them being implemented?,"I have adapted really well to the social isolation and working from home thing. I have a great routine now (way more balance with work/life/health than I did pre-covid) and love having more time to spend with my pets, reading & contemplating. All the zoom meetings for work and maybe 1-2 virtual “catch ups” with friends every week are adequate for me socially. 

However when I think about how I’ll have to go back to my typical 8-5 grind with a 2 hour commute on top of those hours, I feel super anxious. Anybody else in a similar boat? 

Note I’m not saying I hope covid continues to thrive, I know it has had a severely negative impact on many people. I am just anxious at the thought of returning to what was my “normal life” that I hated."
"I don’t know who needs to hear this, but, unclench your jaw and relax your shoulders.","Yes that’s it, relax, you deserve it. :)

Edit: every time I get a notification for my post, it reminds me to do this lol."
Does anyone else constantly feel like they’ve done something wrong after social interactions?,"Basically the title. I constantly feel like I’ve done or said something wrong or offensive and somebody is mad at me after social interactions. Especially with my family and friends. Even if the interactions ended positively and with hugs goodbye and such. I don’t have a bad relationship with any of them. I don’t consider myself anti social. I’ve mentioned this to my husband and some friends and have been told it’s all in my head basically(in the nicest way possible). My husband will reassure me that I’ve done nothing wrong and no one is mad at me, but I usually have a really hard time shaking the feeling and sometimes it even lasts into the next day. It happens all the time. He and others will say even if someone is mad at me that they’ll get over it, probably before I even see them again and I shouldn’t worry about it, but for some reason I can’t shake the guilty feeling. Is this just me?

EDIT:  I never expected this post to get the response that it did. I want to reply to everyone, but don’t want to be a broken record either. I’m sorry you all are suffering with this as well and I hope we all find some relief someday. It really helps me to know I’m not alone in these feelings. I hope knowing you’re not alone brings you some relief as well. And I’m nobody special, but if anyone ever needs to talk or share experiences I’m here."
Anybody else ever find themselves staying up late purely to make it feel like there’s more time between now and tomorrow??,I have work in the morning and my brain is like “if you stay up til 1 then you have another half an hour to relax before going to sleep & waking up anxious for work”
I DID IT.,"I FUCKING DID IT. 

I have extremely bad driving anxiety and I have been stressing about this trip for months and today was the day. I drove 2 hours ON THE HIGHWAY!!!! I WENT LIKE 100 km/hr!!!!! and then 2 hours back (in the dark!!!) !!!!!!!

I bought myself a whole pizza when I got there and SMASHED IT BC I FUCKING DESERVED THAT SHIT hahahahah

It’s literally 1:45 am and I’m so fucking happy. If you’re reading this and you’re too scared to do something, DO IT. On the other side of fear is freedom. I feel like I just beat a boss level. 

Good night guys, sending you all good vibes.

Edit: Thank you so much for all your lovely comments and to whoever gave me gold! I’ve posted about this issue on this sub for a while and I’m so grateful for all the support I’ve received. Wishing you all the best. 💖"
"Does anyone feel depressed that their anxiety has kept them from experiencing major parts of a ""normal"" life?","I barely went out with friends when I was in high school. Always heard about my friends going out to parties, but I never went to one myself. In university, I avoided going out with friends, and mostly kept to myself. At the time, I didn't realize I had anxiety. But now, when I look back, knowing that I had anxiety and depression, it makes me really sad that I missed out on socializing and parties. Even though deep down I feel like I would have felt uncomfortable at them anyways. Not sure if that makes sense or not. It's sort of feeling like I wish I could have enjoyed them even though the reality is that I probably wouldn't have enjoyed them much even if I had had the opportunity to socialize more."
"[UPDATE] after almost canceling a job interview due to anxiety, I forced myself to go, went in there, and killed it!!!","I GOT AN OFFER!!!!!!

I went back to pessimism and expecting the worst after a few days of not hearing back, but I did today, and they offered me the job!!!!! Higher pay, almost double the PTO, amazing benefits... I’M JUST SO EXCITED!!!! 

I know on my first day I’m gonna have massive anxiety and second guess everything and wish I stayed in my comfort zone but I don’t even care because this just proves to me that if I push through those nasty feelings I really can do anything!!

Thank you so so so much to everyone that gave such kind words of support and encouragement. This has been a HUGE life changing step for me and it’s amazing to be able to share it with all of y’all.

Edit: I promise I’m done bragging on myself after this but I just negotiated a (slightly, not by much but still!) higher salary as well! I’m over the moon, I can’t believe I’m me and I did this haha. 

Thank y’all, the support in this sub is unbelievable and I’m so glad these posts were able to motivate people. :) every single one of y’all has it in you!"
If you're reading this it means I did it,I'm really socially anxious and thinking about posting this is making it hard to breath and making me shake but I'm trying to get better and if you're reading this then it means I am taking a small step towards my goal and this is my first post so I'm even more anxious. I'm trying so hard from crying and deleting this post. I've probably wrote 50 different sentences and deleted them thinking it's not good enough and that people would be upset. I really don't want to but I got to try. It's been 15-20 minuets since I started to type all of this  and I'm really  scared on posting it. Please don't be too hard on me... I'm sorry for  the mess of the post  but if you're reading this it means I did it and thank you for reading.
"Anxiety Pro Tip: Anxiety thrives on your avoidance. If you have an anxiety-provoking task to do, make it your first task of the day. Otherwise, it'll only start to feel scarier and harder to complete in your mind.","Avoiding the anxiety-provoking task feels good in the short term because your brain feels like it has avoided some kind of threat. This is one of the reasons why procrastination feels so good! However, avoiding the task just reinforces your belief that the task *is* a threatening one, so the anxiety gets more intense the next time you come to it. 

Making it your first task will eliminate this vicious cycle altogether. You'll likely feel better as you'll get a sense of achievement from ""beating"" the anxiety-provoking thing. There is also the added bonus that it won't be nagging the back of your mind for the rest of the day!

All credit for this tip goes to u/TomClinPsy who posted it elsewhere but it was removed for some reason. Luckily I had screenshot it because it felt so profound to me."
"I saw a saying that read ""Never get so comfortable in pain that you forget happiness is still an option""",Just thought someone might need this.
1 month with 0 panic attacks,I'm so happy
anyone else get anxiety attacks from memories of bad/cringy/nasty stuff from the past?,"I feel like I've become a shit ton better as a person, but there are those nights that make me relive all those bad moments and I beat myself up so much that I get seriously messed up. 

What I wouldn't give to go back and do it all over the right way again..That way, I might've made better friends who would've lasted through maybe?

Or maybe these experiences, they've made me better as a person? They've shaped me? I dont know at this point.

edit - didn't think so many people struggled w this. Awful stuff, but we learn from them and grow as people? take care, all of you, xx"
"Your mental health is more important than the test, the interview, the meeting, the family dinner and the grocery run. Take care of yourself.",Have a blessed day!❤
"Today I cleared 12 bags of old clothing and things out of my room to donate and clear my personal space, I have a job interview next week, and I start therapy tomorrow. Feeling very hopeful!",Edit: Thank you so much everyone for the lovely words and support. And thank you for the silver!!!
Unclench your jaw,Whoever needs this reminder :) I usually do
if you read this I love you,you're loved. I love you :)
"Does anyone else say ""sorry"" as an impulse?",I say it even when I don't mean to. It's so freaking annoying and I need to break the habit
"To you reading this I hope you have a nice day and I hope you get over your anxity and remember to never lose hope, you are strong. ❤","Edit : thank you anonymous internet friend for my first gold ❤ 
Edit 2 : the fact that I made more than 1k people around the world feel lil better is crazy idea to think about 🙏❤"
"I went to groceries, i cleaned my appartment and I cooked myself a burger with potatoes for the first time in 3 months.","I just needed to tell anyone, I feel like I finally got my shit together for the first time in a long time.

Edit: holy sh, this thread blew up ! Didn't expect that. I can't respond to everyone but thanks a lot for your support guys ! I had a cool day at work today and some of your comments were really awesome, thanks a lot ! I'll keep on doing me-stuff and having me-time as much as I can, starting today. And thanks for the 2 medals lol"
Is anyone else starting to worry more about the financial/economic impact of COVID-19 than about the virus itself?,"As a young and relatively healthy individual I'm not worried about contracting the virus, but I am following all CDC and WHO recommendations to prevent transmitting it to those who are more vulnerable. With every passing day I get more and more anxious about the financial and economic crisis that is developing. New reports suggest that this can go on for 12-18 months. I have some huge life events coming up and everything is in flux. What was once solid ground is now complete turmoil."
Anyone else have to keep reminding themselves the tightness in their chest is probably just anxiety?,"I’ve been so stressed and anxious these past few days, especially after my job closing due to the covid-19 pandemic.  I keep feeling tightness in my chest and then get stressed worrying I might have a mild case.  Then I have to stop and put myself in check.  Do I have a fever?  No.  Body aches and chills?  No.  Dry cough?  No.  Does anyone else have to keep themselves in check like this?"
Anyone else suffer from depression too and have to decide whether or not to drink coffee because it’s a choice between my anxiety being worse or being exhausted all day?,"Holy crap I didn’t think this would get this far up there, thanks everybody it’s good to know I’m not alone. I’m sorry you guys have to experience this too though, I wish I could answer all the comments but just know I’ve read them all and they’re all appreciated! This sub is a fantastic group of people."
June will be an amazing month.,June will be an amazing month. June will be an amazing month. June will be an amazing month. June will be an amazing month. June will be an amazing month. June will be an amazing month. June will be an amazing month. June will be an amazing month.
How many of you guys lurk the anxiety subreddit but don't post/comment?,"Because, anxiety. This is my first post though, so...progress?"
"Does anyone else get overwhelmed and anxious as soon as they have a responsibility to fulfil (answering a text, an email, etc.)?","I’m going back to law school next week, and a bunch of communication from volunteering groups, clubs, friends, etc. have started up again. I feel like crawling under my covers every time I think about having to schedule a meeting or return a phone call to someone. It hasn’t ever been this bad before. I don’t even want to answer texts from my friends that are back in town, because that means we need to get together. 

Ex: I had to send a mass email to a few organizations to see if they wanted to arrange a presentation with my volunteer group. I’ve already received a voicemail and an email in response. The idea of needing to respond and figure out logistics makes me body turn to stone. I just want to ignore it all and pretend I never heard back from anyone...

Does this happen to anyone else? Do you snap out of it?"
"I’ve failed my license test 4 times because I have test anxiety, especially when someone’s sitting next to you writing notes but today I PASSED! It was so scary but I finally did it (I’m 21)",Edit: it was my 5th time total
I’m anorexic and have several anxiety disorders and I went grocery shopping by myself for the first time in 6 months! ☺️,"I’m 23 and female and this was just really reaffirming 

“It’s just really nice to win one.”
- Kevin Malone 😂

EDIT** GUYS I didn’t expect to get so much love and kindness from you all!! This has quite literally made my day and in the running for my month lol.  These struggles are so rough and facing it everyday is really something.  But; struggling does not negate your strength.  We are infinite wells of resilience because we have to be, we all deserve love and kindness and warmth every single day.  ❤️❤️

For reference these are my diagnoses:
Generalized Anxiety Disorder
Social Anxiety Disorder
Panic Disorder
Body Dysmorphia  
Anorexia Nervosa
PTSD from childhood emotional/physical abuse 
PTSD from being raped when I was 17
PTSD from the illness and death of my mom at the age of 12 

I’ve been unemployed for 6 months and my last job was in a RAMPANT environment of sexual harassment it was disgusting.

I believe in you all.  Be gentle on yourself first and always.  Don’t let the world and your illness rule your life.  Filter what you take in and surround yourself with.  Thank you all. 😊❤️"
Took a huge step. Went to see a therapist today. Had a panic attack while leaving went there crying and all. But I did go.,"
Feeling completely drained now. Am cocooning in my room now.

Wow I love this response and all the encouragement and love. Thank you all. I am trying to respond to every comment. But it gets overwelhming. It will take time but I am reading every comment."
Let's post good news on the coronavirus here.,"A place where only good news is posted, please keep this a positive thread. a place we can go for some reassurance that everything will be okay. We WILL get through this.

edit: the link for this thread will be posted in the main thread, I will keep updating so save this thread to keep checking ♥️ stay healthy and wash those hands 😊 


guys for the love of god stay away from twitter, fb and all the big news outlets I know it's hard but no good will come out of it

this is a good article 

https://medium.com/@brandonricharda/10-reasons-to-feel-optimistic-de-spite-coronavirus-10073eae0ec4

JUST POSITIVE NEWS ABOUT COVID-19

There is so much negativity in the news about COVID-19, we want to give you all the positive news that is happening with research, clinical trials, improvements in statistics and anything that we can be positive about that you may not have seen.

Check this out guys

https://www.justgivemepositivenews.com/


AMAZINGLY GOOD NEWS!!!!!!

A Chicago hospital that tested antibodies found 30 percent of those tested had antibodies.

https://chicagocitywire.com/stories/530092711-roseland-hospital-phlebotomist-30-of-those-tested-have-coronavirus-antibody

Magnifying this percentage to the entire USA population, that would mean the death rate for the virus is 0.015 percent, about on par with the seasonal flu. 
thanks 

/u/logicalcreations2406 for posting this!


some really good news regarding asymptomatic spread! 

Per Wuhan Health Commission, the 300 asymptomatic carrier identified by large scale PCR testing between 15/05/2020 and 01/06/2020 have had their saliva and throat swab sample taken, and these samples have undergone isolation and incubation experiment at Chinese Academy of Science Wuhan. All samples have failed to result in incubation of live virus.

Experts believe the negative result of incubation experiments with the saliva and throat swab sample point at either minuscule viral load, or non-viable viral fragments unable to cause infection. Furthermore, samples from toothbrush, drinking cups, masks, towels and other personal effects have been taken from the 300 asymptomatic carriers, all have tested negative. On top of this, 1174 close contacts of the 300 asymptomatic carriers identified have all tested negative on PCR tests. All of these point at the conclusion that the asymptomatic carriers discovered in Wuhan are not infectious.

http://www.xinhuanet.com/politics/2020-06/09/c_1126091646.htm"
Skipping classes for my mental health...which impacts my grades...which impacts my mental health.,✨ college ✨
"My biggest fear is that my anxiety will always keep me in my ""safe zone"" causing me to live a life of mediocrity that I will one day really regret.",Currently trying to tackle this issue but its my biggest challenge. 
"Anxiety isn’t cute, anxiety is thinking someone died because they haven’t messaged you in a day.",Either that or they hate you. 
Today I had a job interview and I managed to go. No one seems to understand that for some people it's a tremendous struggle.,"I have really bad IBS with panic-/anxiety disorder and those two combined make it extremely difficult to travel. I don't have a car so I have to use the public transport.

90% of the time when I leave the house I get the runs. Like really bad. Almost always I have to turn back, take a shit and try again. Sometimes it doesn't work and I can't go. Not even to the grocery store for example.

I've used meds (benzos) for it for a while which usually work, but whenever I try to seek help the nr1 concern is "" well you gotta get rid of those pills "". I don't care a flying fuck if I'm injecting heroine if I manage to go to work, leave the house, do normal stuff.

Not even 1% of people can fathom the struggle some people have to just go buy groceries.

I've tried to seek help with this but every single time **only** thing I hear is "" stop using meds "". I've used benzos 3 times in past 3 weeks. I'm improving, no one cares. I'm working on my diet and excercise, no one cares. All I hear is "" stop using meds, stop using meds "". From medical professionals, family and friends.

True, meds might make it so that without them normal things become more difficult. But my goal for now is to travel to work. Any means necessary. Okay I stop meds then what ? No one gives me the step 2.

I've been unemployed for 6 months and my nr1 goal is to get a job, manage to get there and do well.

Thanks for the rant. Peace.

Edit/update:

Had a dr's appointment today.  I told her several times that my only goal is to travel to work. I said very clearly that I still need help, but I didn't care if it was in a form of benzo's, other meds or therapy.

As a result she prescribed more benzo's. And psyllium seeds. Also according to her, stomach problems and panic disorder are completely unrelated and have nothing to do with eachother... sigh."
anyone else constantly wondering if their shortness of breath is due to anxiety or corona,"Thank you guys for all of your responses. This makes me feel a lot better about my current situation, and I hope you all feel a bit less alone after reading through these responses."
I always want to post in this subreddit but I know I’ll feel like a failure if I don’t get upvotes.,"Does this happen to anyone else? I actually think this sub is a great tool for cathartic sharing among people with anxiety, and I know I could derive some benefit in allowing myself to post more. But there’s some silly irony in me thinking “Well what if this gets ignored? What if people think this is dumb or invalid?”. Even right now as I type this I think “Oh yeah this is so witty and meta, this will definitely get me to the top of the sub” which is so in line with every obsession I have about being special, being great, being loved, etc — and my inability to just do or enjoy the small things for what they are without some greater sense of meaning. 

EDIT: Ha, this blew up, how poetic. The joy or validation I feel from the upvotes doesn’t match the negativity I would have felt if it went unnoticed, which is good to know! You all are wonderful and this is a great community. I’ve come a long way with my anxiety and I’m working on a project to help and give back to those struggling and those who have helped me, so I hope to see you all here again. ❤️❤️❤️"
