Does anyone else feel physically weak and tired after going through a long period of anxiety that eventually died down temporarily?,"I had a terrible week. I couldn't bring myself to do much of my school work on time because of my anxiety. By Thursday, I managed to calm myself down significantly but I'm feeling the consequences at the moment. My body is sore, my neck and head hurt constantly, and Once 8 pm hits, I feel like dropping unconscious to sleep (that's how tired I am). Is this normal?

Edit: u/ItchyLeftArm mentioned that this effect is ""General Adaption Syndrome."" Here's an article in case anyone was interested: [https://www.healthline.com/health/general-adaptation-syndrome](https://www.healthline.com/health/general-adaptation-syndrome)"
Who else regroups in the bathroom?,"When I'm in panic mode or etc., I find bathrooms to be a useful place to get somewhere alone for a minute to regroup. Only downside? My in-laws think I have bowel issues lol."
Anyone have “career anxiety”?,"I have a constant worry that my current job or prospective jobs are not the “right” decision for my own career development.

"
Anyone else get that gut feeling that it’s gonna be a bad day and the anxiety just flairs up?,"I feel this right now. I have to work again tomorrow and I feel like I’m gonna log on to my laptop and then see a bunch of “negative” messages from senior workers. 

This job has caused me enough stress that my anxiety has skyrocketed. The amount of anxiety attacks I get, oh boy. I know the solution would be to leave but I can’t afford that right now. 

But does anyone else always get this gut feeling like oh hey today’s gonna be a bad day and then it actually does?"
I signed up for Reddit a year ago this December. It took me almost the entire year to overcome my anxiety about posting for the first time,"I know it doesn’t look like much, but this post was almost one year in the making. Anxiety is a bitch.


Edit: My most heartfelt thanks to the kind redditors that have twice endowed me with silver! You guys are seriously amazing 💙💙 thank you for all the kind words and messages of encouragement.

Also, words"
"Has anyone found that their ability to read text, write, and spell drastically goes down when anxious?",Just something that has been happening too much lately and was wondering if this could be contributed to anxiety.
I got rid of Facebook and Instagram today after 8 years.,"I couldn't feel better, it's like a weight has been lifted off me and alot of stressful ties cut. Now I can live in the real world without being too sucked into my phone, and the only people that can contact me are the people I want to be able to. For years I lived a very bad life, and now I feel safer it won't come back to bite me."
Dont you hate when you wake up and know its going to be an anxiety day?,"So much is changing and I don't like change, I also don't like confrontation. There's both right now in my life. My husband is starting a new job today and a teacher at work has some stupid beef with me for making a joke. I'm having a hard time dealing with it all at once, it feels like I can't breathe

Any tips would be greatly appreciated"
I get anxiety from posting/commenting on Reddit.,"This sounds so silly, but can anyone relate? I want to contribute to conversations/post things but I worry about downvotes. How STUPID is that? It shouldn’t matter. But here I am, worrying that this post will embarrass me. And if I do post or comment, I seriously worry about it and if I look stupid. Like I’m a complete stranger to everyone anyway. Please tell me I’m not a total freak. The only time I can comfortably post is if I’m drunk and that results in me usually deleting them. And I shouldn’t drink anyway. I just wanted to get that off my chest.

EDIT: I should probably add that I’ve been drinking and that’s why I had the courage to post this because I’m a fucking coward.

EDIT #2: I found out this same issue was posted recently. Sorry!"
"Anyone else get this vague, stressful feeling that you have some insurmountable task ahead of you tomorrow, or something similar?","So this may sound a bit vague so bear with me. Often times when I'm feeling incredibly stressed out, over no particular reason, I often get this feeling of stress over the immediate future. It feels like I have some incredibly taxing and difficult task ahead of me the next day and it makes me feel cripplingly anxious and stressed out in the present. 

To me it sort of feels like I have a final exam(or something similar) to do tomorrow, every single day. This is despite the fact that I actually dont have anything stressful to do tomorrow. 

Anyone else get this specific feeling?"
Does anyone else fear phonecalls?,"Basically, I have to admit, I struggle with calls, whether it's incoming or if I have to make one. I become all hot and shivery all of the sudden, and I can feel my pulse going nuts. It's something confronting, ""putting you on the spot"" about calls, that makes me extremely nervous - it's like taking oral exam without having prepared for it. Can anyone relate? Does anyone have ideas on why this fear might exist or how to overcome it?"
"Been awake since 4am, couldn't eat all day, major anxiety attacks ...was successful at my interview and got a promotion!","It's been a long time and a bad year but i finally realised my goal and I succeeded at an interview today! 

Edit: you guys are awesome!  Thank you all it's proper made my day the kind words on here!"
does anyone get anxious around the noise of yelling?,"i always have a fear of loud yelling even if it’s not directly at me, i don’t have a fear of loud noises at all but if it’s yelling it’s different. it sends me into panic and overthinking. i’ve been though traumatic things growing up so maybe that’s it,or does anyone else feel this way too with their anxiety."
I got a 4.0 this semester in college!," I don't ever like to post anywhere about my grades, but I got two A+s and two A's this semester in college, making it a 4.0 for the semester! 

I've been told by therapists before that it's at least 10 times harder for me to do any given assignment in school than most students as a result of my anxiety. I had some really hard tests and assignments this semester, a hell of a lot of panic and test-related nightmares, but I did it. 

I'm at a relatively difficult college and I even suffered through a horrible kidney stone that caused me to miss two weeks of class and cost me a trip to the emergency room. I also had chronic bronchitis that caused a couple doctor's visits as well. I genuinely don't have friends at college or groups I belong in. I have depression alongside this shit anxiety and I went through this all alone, away from any family or anyone that could help.

It may not be much, but I did it, and I made it through. And you guys can, too! 

Please never hesitate to get the support y'all need. If you can, reach out to get accomodations with your school and if you get sick, let teachers know! Get doctor's notes. Most professors are more understanding than you'd think. 

Y'all got this! I hope anyone who's semester just ended had a great one, and everyone else have a great holiday break and happy holidays in general."
"People who laugh, yell, and mock the people with anxiety and panic disorders are sad people.",They have no idea what we have been through or why we have such disorders. Truly people these days have 0 empathy and yes I mean empathy not respect. No one does anymore not police not nurses and hell definently not most of the general population.
"Wake up feeling fine until I ""remember"" to feel anxious... anyone else deal with this?","Hi all, 

Recently I've been dealing with a lot more latent anxiety than normal. I've struggled with it for years, but over the last few weeks there have been a lot of days where I've spent the entire time with a pit in my stomach. It's weird - I'll wake up feeling totally fine, then the moment I realize I'm not feeling any anxiety, it's like a switch flips and I just start accumulating it right then and there. What the hell is up with this? I'm not even having thoughts about anything specific while it builds up, it's just like I can't stop something that my brain has decided is normal. 

I think this started while I was having a rough time with a friend recently. That situation has since been resolved, but the pattern of this gnawing feeling has stayed. 

Can anyone relate to this? I'm not sure how to stop triggering this and it's bothering the fuck out of me. I don't want to feel like I can't relax even on the weekend or after work. :/ "
I am so proud of my wife,"My wife has extreme anxiety and when she does something that upsets me, that triggers it. It is super hard for me because I can never express myself in our relationship. 

Well tonight I was having a really hard day. I expressed it to her and she ignored me. She didn’t pick up on how hard my day was even though I expressed it very clearly. Later she could tell that I was even more sad and knew it had something to do with her. I didn’t want to go into detail because it would of set off a panic attack and I wouldn’t of been able to handle both my shit and her panic attack. I needed to take care of me tonight. 

So I tried to be as involved in our night as possible but let her lead and suggest what we did tonight. Obviously she could tell that my night was off and she started to become very distant. I got more upset at this because I wanted to be comforted. 

After a couple of hours she came out and said “ I know you need me tonight but I don’t know if I am strong enough.” She was talking behind a door and refused to come out. “But I just want to let you know that I love you and one day I will be able to comfort you.” 

After we kept talking she finally came out and I was able to open up and get the care and love that I needed. 

She didn’t have a panic attack. She did cry and almost went into it a couple of times but she was able to stay present and be what I needed in a partner tonight. 

We have been working on this for two and a half years and tonight was a major breakthrough. I am so proud of how far she has come."
The worst thing for me about having generalized anxiety is I have anxiety about my anxiety.,"I constantly feel the need to explain to people why I constantly over think or internalize everything. I don't want people to think I'm this crazy, narcissist that thinks the world revolves around me so I explain that I have pretty severe anxiety issues.... and then I worry that I'm that annoying person who constantly feels the need to justify their actions or statements by leaning heavily on a health issue.... so then I apologize for bringing it up so much. 

My anxiety disorder is causing me anxiety. 

I just left a comment about not being able to sleep at night because my brain won't shut down and I can't stop analyzing everything that I said or did throughout the day. It went from 1 to 0 in less than a minute so I deleted the comment because it sounded whiny and a little crazy. Why do I care so much about what other people think? Why do I worry so much about how I come across to others? It's exhausting.

I'm feeling shity, might delete later. IDK 😘"
Something I REALLY gotta get off of my CHEST!,You are awesome. You matter. And I love you even if I don’t even know you. Keep moving forward because you’re worth it!!! <3
The Biggest Problem With Anxiety is that It's Hard to Tell When Problems You're Having is ACTUALLY Caused by Anxiety,"Case in point:

&#x200B;

I've had a tension-like headache for two fucking weeks and none of the doctors I've seen know what's causing it. 

&#x200B;

Anxiety? Could be.

&#x200B;

Not anxiety? Could be.

&#x200B;

Brain tumor? Probably. (This is a joke, but you guys probably get it.)

&#x200B;

That's just making the anxiety worse. "
I start a new job tomorrow. Wish me luck 😁,"I don't have a lot of people to celebrate this milestone with, but I knew y'all would understand the significance. I'm anxious af, but also excited. I think this is going to be good.

UPDATE: it went really really well! Thanks everyone for your support ❤️ I appreciated all of your comments. They helped me stay calm."
"Anyone else feel so anxious yet they instantly ""sober up""/relax when other anxious people are in need of your emotional support?","As the title says, I find that in really tough situations where I'm having a bad day - I instantly feel less tense when I see someone else suffering from severe anxiety. In fact, I always reach out to them (here and irl) and offer them advice which makes me feel better too. Now if only I took my own advice seriously..."
"Anxiety is like having a toddler scream in your ear 24 hours a day. Zoloft is a set of headphones that lets you ignore it occasionally, but doesn't actually do anything to calm the screaming.",.
Depression and anxiety together is the worst.,"Depression makes me want to stay in bed and sleep all the time, and I'm always super tired when I'm not purposely overloading my body with sugar and caffeine.
  
  
At the same time, though, anxiety makes me stay up way longer because I'm constantly thinking, cringing, and panicking internally about some event in my personal life or some work scenario that I could have handled better.
   
  
These two issues mix together like oil and water. Like bleach and ammonia. 
  
  
I feel like I can never win."
One of my favorite phrases my therapist told me to keep in mind when I start to feel anxious...,"He said, “you want to notice your thoughts as they float down the river of your mind, without getting swept away by them.”

Just “noticing” my anxious thoughts, not entertaining them nor judging or analyzing them helps me to de-escalate my worries before they turn into a full blown panic attack. 

I hope this helps in some way."
Didn't go to a party due to anxiety and now I have anxiety because I didn't go,"This is SO silly but there was a little party today at my university and my stomach was twisting in knots about going so I skipped it even though my sorta-friends were going. I just stayed at home for hours pretty much doing nothing, feeling sad for no reason, but I was under the impression we would all go to a club tonight anyways so I figured i'd save up my social energy for that. And my roommates came home and don't want to go to the club anymore, so now I'm feeling awful and anxious and so sad that I didn't go, I SHOULD have gone and now I have so much regret and anxiety that I missed out. I think I would have had so much fun but yet again I feel like I missed out, and wasted my night. This keeps happening, I really have to get better at forcing myself to just do things..."
Got a girlfriend,I finally got over my anxiety of dating after a really bad relationship a few years ago and asked out a girl I had a crush on for a while and she said yes ☺.
Does anybody feel anxious to the point where they want to vomit?,"It happens to me every day and I don’t even know where my anxiety is coming from. 

Edit: WOW. Thank you everyone for commenting and giving advice (honestly did not expect to get an answer)! I hope you can all pull through and feel better <3"
DAE experience 'burnout' for several days after one very rough day?,"After a day where I'm an absolute mess and have to push through some very tricky anxiety I'll end up feeling burned out for about 2 weeks afterwards. I struggle to eat and I wake up exhausted every morning and feel dizzy and in general have a much higher baseline of anxiety that usual.

Anyone else have this? Could it be something like Adrenal Fatigue?"
Any other chronic jaw clenchers here?,I woke up this morning with AWFUL pain in my teeth because i spent the night with my jaw locked shut. I do this when I’m stressed. I also tend to grind my teeth. I’m always so tense! My teeth are in a world of hurt today.
Slow down. It may feel like you have to keep up with the fast pace of everyone around you but you absolutely do not have to.,"I've been more mindful about the speed of which I talk at, and I've noticed that I think I may be talking at a speed I'm not too comfortable at. Maybe it's my unconscious nature to do so, in order to 'keep up' with people. I hope to get in the habit of slowing my speech down just a tad so as to stumble and stutter less. 

I've also been trying to think more about the state of my body. 
Is your body relaxed right now? Do you shake your leg? Why aren't you still? Unless you're exercising, you should be still and calm. "
Today I managed not to look away when a girl made eye contact.,"I'm usually very shy and insecure around girls. If one makes eye contact I look down or away immediately especially if I find her cute.

Today though a group of three attractive girls were walking towards me. My eyes met with one of them, I held her gaze for a second or two and she gave me the biggest most beautiful smile! It really made my day and gave me a huge confidence boost.

It made me reconsider what is it that I'm being insecure about? I'm lacking confidence and I don't even know why. Amazing what a simple smile can do!

EDIT: Thanks for the award stranger. I'm glad it cheered someone else up too!"
Does anybody else feel mentally exhausted from battling with there anxiety constantly?,"People use the term ‘mentally exhausted’ and I’ve never understood what they ment, but I do now, I’ve had severe anxiety and daily panic attacks for 6 years now (turned 26 yesterday) and for my birthday my girlfriend arranged for us to go on holiday for 4 days, which of course on 1 hand I need the break, but on the other i didn’t want to be killing the holiday by not wanting to do stuff, so I got myself some backup Valium to carry around with me in case my anxiety was to get to a point where I could not cope, I’m on my last night now going home in the morning and I did not end up having a single tablet other than my daily propranolol, and I’m super proud of myself I have did everything from going to fair grounds to shopping in busy town centres and markets, I’ve been out from morning until night every day, which is obviously good, it has took me so long to get to this point and it has not been without it’s set backs, and I mean really bad set backs ones where I feel like I’m back at square 1 again, but I always dust myself off and start again, but recently I feel like my brain could do with a rest, I’ve had panic attacks daily while I’ve been here but you would of never been able to tell, my symptoms seem to change every now and then, at the moment mine are- not being able to take a deep satisfying breath or yawn, pains in my chest and pressure in my head, and insomnia, but you no what guys I’m happy believe it or not I just wish I could be normal again, but until then  I will just keep plodding on and hopefully get there 1 day. "
Does anybody else find themselves clicking the 'discard post' button a lot because they are afraid of being judged?,"Edit: Wow, I didn't know that many people had the same issue. Thanks for everyone's feedback!"
Apparently May is Mental Health Month and I’ve officially decided to seek help!,"I’ve been on medication before and I don’t love it-but that’s not to say that it doesn’t help. I just didn’t like it for me. However, I’ve never really had continued help. So now that covid is taking over and my anxiety is getting a lot worse I’ve officially decided to reach out to some therapists in my area. Fingers crossed I find a good one!

Edit: thanks so much for the love everybody! we are all in this together and need to do what’s best for all of us, individually. 💜"
Does really bad weather soothe anyone else's anxiety?,"For a very long time now any time there's a bad storm or something, it makes my anxiety go down so much. To the point I like to put on storm sounds when I sleep at night. I really don't get it, I was deathly afraid of storms when I was a kid. But I check the weather all the time to see when it's going to storm. I sleep better and even feel better and more energized all day. I hope I'm not alone."
Does anybody else feel mentally ill with chronic anxiety?,"I know it is a mental illness in itself but I’m talking about constantly feeling “off”.. like way less intelligent than you used to be, hard to process your thoughts in to words so they come out jumbled or silly sounding, constant headaches and just feeling like you’re on autopilot looking in to someone else’s life.. Idk I’ve been dealing with this for 2+ years and I still find it hard to believe it’s just anxiety. I’m terrified it is something else that the doctor’s are missing which I’m sure is just anxiety fueled hypochondria lol. "
Does anybody else feel more comfortable in one-on-one conversations compared to group conversations?,"I (30M) definitely feel more comfortable in one-on-one conversations compared to group conversations. When it comes to group conversations, my anxiety levels go though the roof to the point where I can’t function properly."
It’s that time again.,"Just in case nobody has told you in a while, unclench your teeth.  Relax your shoulders.  Take some deep breaths through your nose, hold them for a few seconds, and release them.  Now, just breath until you’re able to sink in to your bed or your seat with your eyes closed. Whatever is stressing you can wait for a few minutes.  You deserve peace."
Do any of you HATE loud sounds?,"Having anxiety and being afraid of loud sounds is so difficult sometimes. My anxiety is nowhere near as severe as it was a few years back but I'm still a little too highly-strung in my day-to-day life and as a result I pretty much jump right out of my skin whenever there's a sudden noise. Even if it's a noise I'm anticipating, like the fire alarm in a building being tested, or an alarm clock ringing, the anticipation only makes me more nervous about hearing the sound. I absolutely hate balloons. If I attend a party and there are balloons on the floor I'll spend the night just waiting for someone to pop one. In my mind there's nothing worse than the sound of a balloon bursting. Back when I lived in student halls they tested the alarms at the same time every Thursday and I ensured I was never in the building at that time. It was a horrible sound and the idea of being in my room (each room has its own alarm) when it went off made me feel nauseous. I definitely believe this 'element' of my anxiety is rooted in something from my childhood, but exactly what that something is I'm not too sure. Do any of you guys have heightened anxiety when it comes to noises, and if so, have you found any coping mechanisms?"
This is what I have to say to my OCD anxiety.,🖕🖕🖕🖕🖕🖕🖕🖕🖕🖕🖕🖕🖕🖕🖕🖕🖕🖕🖕🖕🖕🖕🖕🖕🖕🖕🖕🖕🖕🖕🖕🖕🖕🖕🖕🖕🖕🖕🖕🖕🖕🖕🖕🖕🖕🖕🖕🖕🖕🖕🖕🖕🖕🖕🖕🖕🖕🖕🖕🖕🖕🖕🖕🖕🖕🖕🖕🖕🖕🖕🖕🖕🖕🖕🖕🖕🖕🖕🖕🖕🖕🖕🖕🖕🖕🖕🖕🖕🖕🖕🖕🖕🖕🖕🖕🖕🖕🖕🖕🖕🖕🖕🖕🖕🖕🖕🖕🖕🖕🖕🖕🖕🖕🖕🖕🖕🖕🖕🖕🖕🖕🖕🖕🖕🖕🖕🖕🖕🖕🖕🖕🖕🖕🖕🖕🖕🖕🖕🖕🖕🖕🖕🖕🖕🖕🖕🖕🖕🖕🖕🖕🖕🖕🖕🖕🖕🖕🖕🖕🖕🖕🖕🖕🖕🖕🖕🖕🖕🖕🖕🖕🖕🖕🖕🖕🖕🖕🖕🖕🖕🖕🖕🖕🖕🖕🖕🖕🖕🖕🖕🖕🖕🖕🖕🖕🖕🖕🖕🖕🖕🖕🖕🖕
Anybody else have anxiety attacks over mundane situations but feel totally numb over more serious situations.,"Like right now I’m freaking out because my arm is in a little pain and I’m at a friends house, it’s 4:00 am and I’m cold and I don’t have a blanket but I don’t wanna wake anybody up by going out of the room to find one or wake them up directly to ask for one. I’ve been pacing back and forth in the same spot for an hour and a half, all because I’m a bit cold and my arm hurts. Same thing happened when I spilled juice on a table at school. I started hyperventilating over spilled juice. And in slightly more serious situations, I feel totally numb and i disassociate. It’s like I’m not there and my life isn’t real. I had to confront my professor about a paper I didn’t turn in yet and when I was about to talk to him, I started to feel lightheaded, my vision stated closing in, my emotions disappeared and I started to disassociate. 

I’m sorry for this somewhat long rant/DAE question that probably doesn’t even make sense. I just hate myself for being like this and I just wanted to get me feelings out."
I built a free mental health app after being stuck in my tiny studio in NYC,"After being stuck in my tiny studio for a month due to Covid-19, I started playing around with mental health apps out there. However, I noticed that most of them require at least 10 mins or more for me to consume the audio content and I often run out of patience trying to finish them. I wanted an app that you can use without reserving much of your time.

Happy is free to use and offers;

* Breathing techniques for keeping calm and relaxed
* Shift your mind from stress and anxiety
* Affirmation and positive quotes to shape your day
* Sleeping tips and tricks
* Calm relaxing music to enjoy
* Free unlimited secure private journal
* Online journal community to talk to people like you
* and more!

**iOS:** [https://apps.apple.com/us/app/happy-a-mental-health-app/id1510821643](https://apps.apple.com/us/app/happy-a-mental-health-app/id1510821643)

**Android:** [https://play.google.com/store/apps/details?id=com.ohsikllc.happy](https://play.google.com/store/apps/details?id=com.ohsikllc.happy&hl=en_US)

Hope you find it useful. Stay safe!"
