#metoo,"I am having a very hard time this week with my anxiety because I feel inundated by the news related to Kavanaugh/Ford allegations. 

In May of 1986, I, too, was gang raped at a high school party by boys that I knew, while I was intoxicated.  I am not going to share the details of the attack,  I am willing to say that I was hospitalized afterwards with significant injuries and I was unable to attend  my high school graduation because I was in the hospital.  Although I am pretty sure that my parents knew my injuries weren’t from “falling down in the woods” and the medical practitioners that examined me were very much aware that I didn’t just fall down.. no one addressed the true nature or extent of it.. even me.

I never talked about it. I never wanted to. I never wanted “justice.”  I wanted to make it go away because for a long, long time I felt like it was my fault. 

After 32 years.. it’s right there.. all over again.

I want to scream at every Facebook poster that has something obnoxious to say about Ford not coming forward.  I want to punch everyone who says “well, she was drunk” or “Boys will be boys.”  I want to vomit every time someone says “why did she wait so long?” and worse.. “he didn’t do anything..he just didn’t help her.” 

I feel like this happened to me last week, not over 30 years ago.  It doesn’t seem fair after successfully tucking it away for so long  it has resurfaced. 

I can see their faces in my dreams again. Even the ones who laughed at my torn bloody clothing and didn’t to anything to help, 

Edit: I adore all of you!! I focused on all of your support and wonderful well wishes.. not on the news!! Thank you, thank you, thank you! "
I felt apart in front of her,"We had such a great time in bed, just hanging around laughing and watching a movie. In one moment I just felt apart for no reason, I crashed, I felt so broken and started crying while hugging. I asked her if she could just hold me tight, as tight as she can and she did that. She said I love you.

&#x200B;

For the first time in my life I felt safe while having a breakdown, all I did earlier was just getting shit for being such a crybaby. 

&#x200B;

I've never felt that much support and we've been together only for about 3 weeks, but when I'm with her I feel safe mentally, I feel like pieces of me are coming back together.

&#x200B;

Thank u for listening"
Calling in sick gives me massive amounts of anxiety,"I started a new job at the beginning of May, and everything has been going well I think. Last night I started feeling bad (i.e. swollen lymph nodes, sore throat, weak body with chills and hot flashes). I went to bed early and took some medicine and Vitamin C, dreading the morning and the fact that I may possibly have to call out. 

Well, I woke up about 45 minutes ago and still felt horrible. But I still got up, showered, shaved, and got dressed, until I finally told myself “wow I can’t do this.” I stared at boss’s phone number on my phone for a good 5 minutes before I worked up the courage to finally call him. He seemed like it was fine and told me to get better,  but my anxiety is still eating at me. 

DAE get anxiety from calling in sick? Especially since I’m new at my position, I feel like I am slacking off and my boss maybe thinks I’m lying. I also get paid hourly, so the 8 hours of work I’m missing is going to mess up my budget for the month

:-("
I finally made a doctors appointment on my own!,"I have general anxiety and social and really hate making phone calls as most people with anxiety do but today I finally made a appointment on my own .My husband usually calls stuff for me but I'm tired of letting this control me. I've been having some health issues and keep putting off going but I know I need to go.I was so nervous to call at first but then I realized theres no reason its not like she was judging me and even if she is who cares.I was so proud of myself all day for something normal adults do all the time lol. My appointment isn't for 3 weeks which sucks and now I'm a little nervous for that but I know I can get through it. We always make things out to be worst than they end up being, its so weird.

&#x200B;

&#x200B;

Wow I didn't expect so much positive comments! Thanks guys so much.This really made my day. "
Saw someone else post this recently but I got a job ☺️ I’m so happy. I just listened to everything my gf said and slowly figured everything out. She is a blessing. You can do it!!!!!!,"All I did was make a profile on the indeed app(yea I sound like a shill but fr) and applied to 7 jobs in seconds this morning. This afternoon got a call from one of them and went in for an interview.  I decided to just be myself and not worry about the interview, to treat them like a friend. They have something to gain from me and I have something to gain from them? Thats how I went into it and it worked ☺️ I’m so proud.  Omg.  Sorry.  I know I’m not special. But I had such a massive panic attack last night I thought I would never pull out of it. Today is so different ☺️

Edit: someone upvote this once so it can be at 420 pls? https://imgur.com/a/mcn1z7y ahhhh.  I love each and every one of you..."
I have a job interview for a promotion today!,"Send good vibes my way please! ☺️😊😁

Update: thank you so much everyone for the positive messages! I walked in feeling super confident, but.... 

I did not get the job. It turns out that I was vastly unprepared for the interview and I had no idea. The interviewer (internal promotion) explained to me that other applicants had gone to the location of the available job (store site) and spoke with different employees they would be working with, requested detailed financial statements and wrote up 90 day day-by-day plans for the store. 

Looking back now it seems obvious, but having been a temporary employee of that store when they were short staffed I figured I already had an insight to it and the day to day operations. I had asked a senior employee who has had the position I was interviewing for what I needed to do to prepare and he never mentioned any of these things. I know he didn’t do it maliciously, he’s a very scatterbrained person and was hand picked for the roll rather than going though the application process. 

Lucky for me my company wants employees who are eager to grow. The interview turned into a discussion about my current location and what is expected of me the next time I apply for a promotion. 

I was terrified that  I would make a catastrophic mistake during my interview and I did. While being so worried about my future with the company and being black listed if I messed up I had forgotten that the interviewers and managers are good and honest people who want to help their employees grow and succeed. Even if we do fail, sometimes there’s a hand ready to help us back up. "
Sending y’all hugs as you prepare for the week.,"I don’t know what you’re going through in your life, but we will get through it together. Remember to drink water and try to take some comfort in some of the things around us.  
  
I had a yummy breakfast today and have been hugging the heck out of my pets. It’s been tough lately, but we’ve got this! ❤️"
Last night I went to a club alone (and loved it). A few years ago I could barely leave the house.,"Saw online that an artist I listen to was gonna be DJing at a club near me. The music is quite underground (techno/lofi house) and none of my friends are really into it. On a whim I thought 'fuck it' and bought a ticket.

Went to it last night. Music was blaring, place was busy af. There are I am, dancing and just feeling the music, not caring about what anybody thinks. While I was there it dawned on me that a few years ago I could barely leave the house without being ridden with anxiety/panic.

I hope this post gives some people hope :)

Also I'm just really happy to be where I am today, looking back on how I used to be."
Does anyone else get random lapses of “contentment” where your mind is at peace before the anxiety comes back?,Edit: Wow. Thank you all for the replies and letting me know I’m not alone. You are all very brave every day. 
"For the first time ever, I ran with my SHIRT OFF!","I'm not even lean, plus I'm as pale as a vampire. Woooooooooooooooooooooooooooooooooooo!!!!!!"
I wrote a bit of a poem about self-doubt. My therapist advised that I share it.,"I'm scared! I shout, to no one

I'm hurting but what if it isn't real? 

There is a duality to the doubt I feel, 

Outward initially, then turned inside - 

Did this even happen? Do I see this right?
 
Can I trust my mind?

Is my memory real or is it defined

by my own narrative?

Of course it is.

Then how do I believe it? How do I know it's true?

If this is just in my head then what do I do?

Am I everything I hate, defined? 

As bad as those I strike down in my mind? 

The jury is out and it seems almost unanimous, 

But what if the crime was committed by one of us? 

The judge is scornful and asks with derision, 

Are you even capable to make this decision?

After all, you wrote your own dialogue. 

Internal monologue, set thrusters to overdrive. 

Constantly in fight or flight, zoom in, analyse. 

Please give me some peace. 

Peace comes to the dead.

I don't want to be die,

But perhaps it might be nice 

To have a rest.

Why can I see so many things?

Not a hallucination, that's not what this is.

It's a sight I can't see with my eyes.

The connections, the links, the things that make my heart stop.

They're not visual but they exist.

They exist in my mind, and my mind alone.

I state them aloud and in pours the doubt. 

I made this.

I have created something, what is it?

Oh, it's anxiety. Hello. 

Sit with me a while. 

Am I propogating my own downfall?

This person is hurting me, let me tell you.

This is all the things that they do;

It doesn't sound bad enough. 

It sounds petty, pathetic, petulent and pitiful, 

Not like it should cause the pain that I go through. 

Yes, I'm being negatively affected by external factors,

But I'm the one processing them.

Am I doing this right?

Is this okay?

Am I validated for feeling this way?

Did I put myself in the wrong situations,

Or have I convinced myself they're bad?

Would things be fine if I saw this differently?

Paint on a smile, adopt positivity, 

Or is that accepting less than I deserve?

What do I deserve anyway?

Decency. Respect. Honesty.

Love, maybe.

But why? 

Do I give these to others?

Can I?

The main point of contention -

Is everything I know just an invention?

We're judged on our action and not our intention.

I'll never see how another sees me, 

So how will I ever truly rest easy. 

Would people be honest? Am I?

You get back what you put into the world.

Did I put this out? Is this projection?

Is this a narrative for my own protection?

I don't feel very safe.

Have I made myself a victim?

Or did other people harm me?

Did they shatter the glass, or did I?

Pandora had hope in her box of demons.

I wonder if doubt always sat on it's shoulder, 

Nesting, infecting, and spilling all over? 

Will things get better, is this just situational?

Are they too broken or too confrontational? 

Or maybe, just maybe, it's me.

I'm always the common denominator, see. 

Am I putting myself in punishing places?

Seeing the lies behind smiling faces? 

Or have I just framed it that way? 

Everything bad happens to me.

Does it really?

I'm resilient. I get through.

Look at everything I've had to do.

I'll tell you, but it's from my point of view.

So how do we know even know if its true?

What would you say? And would I believe you? 

Where do I go when I can't accept my own truth, but can't accept another either?

I view everything I perceive through a fear being
deceived. 

Can any of us be believed? 

I don't trust because I don't want to be wrong.

But then I can't trust myself. 

What if I'm the one with the big bag of tricks?

Pull the wool over my own eyes.

Fill my mind with my own-brand lies.

Is there respite? 

Is there relief? 

Whats the cure? 

Is it self belief? 

How do I believe what I know can't be fact? 

How is everyone else maintaining that act? 

Am I alone?

I feel alone, I whisper, to no one.

[Edit: thank you for comments. It's good to hear this made you feel seen. And thank you to the anonymous Gold and Platinum givers 😭 so much appreciation for you all. We're not as alone as we feel, it seems.]"
"I got over 50 downvotes on a comment I left as a joke, and cried because I thought I hurt people's feelings","Someone left a comment that was a pun, and I joked about downvoting them because of it, but I actually upvoted instead, then commented that I upvoted it. I checked Reddit just now and saw that it had over 50 downvotes. I feel absolutely terrible. 

The comment I'm talking about: 
""I almost had to downvote your comment because of the pun. Take my upvote, you hilarious bastard."""
Anyone have to pee a lot when they get anxious?,"I think it's 100% anxiety related as when I am not in my head and stuff I don't have to pee a lot. But when I do get anxious it just doesn't stop it's like every 5 minutes and its like how can there still be fluid left in me at this point. 

&#x200B;

Wondering if anyone else has dealt with similar issues and if you have been able to solve it some way"
Fiancée has anxiety during long car rides. How to have a not anxious fiancée. A 6 step process,"Step 1: Turn the air-con to minimum temp, which is 50 for us. Turn on recirculation to cool it faster. 

Step 2: Load tank top and shorts wearing fiancée into back seat. Buckle aforementioned fiancée in. Wait for hypothermia to start to set in (just kidding, just enough to be a lil cold) 

Step 3: Lean seat back, put blankets over fiancée. 

Step 4: Adjust neck pillow on fiancées neck,  give iPod (which is plugged into car) and put on Spotify. Place earbuds in her ears, adjust volume to a comfortable level. 

Step 5: Drive for comfort, expect her to fall asleep as soon as we get on the highway. Bring air up to 68F and turn off recirculation. 

Step 6: Awake fiancée on arrival to destination. "
"Does anyone else not consider Sunday a ""day off"" since you spend it in a constant state of panic thinking about the next day and week?",It's nauseating and exhausting. I can't eat or concentrate. I feel sick. Cold sweats and panic attacks. I hate the anticipation. It only fuels my anxiety and panic. How do you cope with Sunday anxiety?
Anyone else with intense social anxiety and always feel like you're being judged 24/7?,"I mean, I know of course others have that happen to them, but I'm really looking for people who can relate. I hate when I do a thing, anything, and it ends up 'wrong' and bad and other people witnessed it. I want to cry, I can't breathe, my chest hurts, I'm light-headed and can't stand, and I mostly can't stand that other people exist and see me. I hate feeling judged when I'm in public 24/7 and can never relax because of others. I'm so hyper-aware of others, I can't ever be myself, I'm not in control of myself or my actions at all. If anyone can relate, please :("
If you're about to get your day / morning started remember this:,"You're not going to master the rest of your life in one day.  Just relax.

&#x200B;

Master the day. Then just keep doing that everyday.

&#x200B;

Edits: Thanks for the silver award!"
"Deactivated fb, it was damaging me mentally. No one has even noticed!","Last Saturday morning, I deactivated fb (with a view to letting it delete after however long it takes). I found that despite 400+ 'friends', I actually wasn't enjoying it at all anymore. I know it's a cliché, and not real at all, but seeing people live their seemingly perfect lives, going out together, watching the little cliques develop and feeling increasingly left out, I decided enough was enough. It's not helping my mental health in the slightest. It has to go.

It is, admittedly, somewhat cathartic and liberating to no longer be a part of that social media network. I still have the ability to use messenger, so can still talk to people. But I think what's hurt a little more is literally only one person has noticed I'm no longer active on there. Which I suppose really hits home how insignificant my online presence was.

I feel very lonely. Friends that used to message me daily no longer message at all, and if I message them, it just gets left on 'read'. There are only so many times I can try, before I stop because clearly they won't respond.

There were so many of those friends that consistently would post / share memes etc about depression, anxiety; suicide. About how much they care and how we should all reach out if we haven't heard from someone in a while. The irony is, no one has. And despite not wanting to believe it, I don't think anyone will.

I work, I go home, walk / feed / play with my dog, then go to bed. I'm usually in bed by 8.30pm (up at 6am) because there seems little to stay awake for anymore.

I've posted on here once or twice, yo other subreddits, but never to this depth of revealing my feelings. I honestly don't mind if no one resounds, it's just useful for me to get this out of me.

I hate feeling sorry for myself, and I hate burdening people, even strangers - so anyone that reads this! with my ridiculous insignificant problems.

I'm just so very lonely. I'm sorry. "
What people think is a cure for anxiety is actually one of its causes.,"When I am feeling anxious and am searching the internet for advice I often come across some form of this:

""Understand that your anxiety is illogical and that you aren't actually in danger""

Suggesting that if you realize this, the anxiety will go away. In my experience it is the exact opposite. Just feeling anxious is one thing. I've felt anxious before big events, it's not pleasant, but if I don't fight it, it comes and goes and I move on. But feeling anxious and knowing you shouldn't be is where the problems really start. When I am anxious and know I shouldn't be, I worry that something is wrong with me and that adds to my anxiety. I can stay like this for weeks or months and I only seem to be able to break the cycle when something especially good happens and I get distracted enough to stop rejecting how I am feeling.

In the last year I have had considerable success overcoming anxiety by accepting it when it comes. This is way harder than it sounds. It's like flexing a muscle you didn't know you had. When I start feeling anxious, I make the conscious effort to accept how I'm feeling. I can't pull it off all the time, but I'm getting better and better at it. The trick is that you have to really believe it. You have to decide that how you are feeling is completely acceptable. You can't trick yourself and ""accept"" your anxiety in the hope that it will go away. You have to really be OK with it sticking around, and just like that it will be gone. It will come back, but you will be building up a skill that will allow you to once again let it pass.

Edit: Talking with several other anxiety sufferers, I'm finding that this advice is more applicable to people who experience chronic low-level anxiety and less applicable to people who experience acute panic attacks."
"I got drunk for the first time in over 6 years this weekend. My anxiety is now so bad, that I am considering suicide.","I haven't drank in many years. This weekend I got drunk. I don't know why I allowed myself to drink, I guess I am not as strong as I thought, and now my anxiety is out of control. It has been almost two days since I drank, but my anxiety is still so bad that I feel that I would rather die than experience one more day feeling this badly. 

I have attempted suicide twice in the past, the last time being 5 years ago. I really don't want to die, but can no longer live with near constant and debilitating anxiety. 

Has anyone ever experienced these feelings after using alcohol? Thanks for reading.

Edit: I don't think it is right to downvote posts about suicide. Can someone please tell me what I said in my post that was wrong? I am really sorry if I should not post here."
DAE ever feel like you are rushing through the day to get home to do nothing?,"I feel like from the moment I wake up until I get home I am rushing through the day and my tasks. It ends up causing me to have more anxiety because I become forgetfull or I half-ass my work duties and end up regretting it. I know if I take a deep breath and just slow down things are much more stress free, but I really want to get to the point where that is my normal. I have a job, i'm done with college, what am I rushing for...? end rant."
I looked after myself today,"I got up and had a shower and shaved and brushed my teeth. I've been doing everything I need to do for my children and around the house, but I've been neglecting myself. I also did my makeup and hair for work. I'm pretty proud of myself"
I just talked myself down from an anxiety attack!,"(Context:My therapist and I have been working on getting to the root of my anxiety, and a lot of it comes from feeling like my needs are less valid than others, and villainizing myself for putting my needs first ever. )

My boyfriends mom wanted to come over and help with yard work today, and it being my only day off for the next four days, didn’t really want to spend most of the day interacting with people and doing yard work. 

I started to go into a panic attack about it, then stopped myself and reminded myself that it’s ok to put my needs first. Talked to myself gently instead of harshly and it really made a difference. 

Still a bit anxious, but I have a game plan for the day and am planning on helping out with the basic yard work then excusing myself to have some alone time with my art or a video game. 

Progress is good."
"Ever since I got blue hair I've realised people weren't looking at me before. They are now, and hopefully if I go back to my natural colour I'll be able to remember the difference","Before, i always thought people were looking at me and judging me. They weren't, and I can tell now, because I now know how it feels for people to actually be looking at me aha."
Probably the most exhausting part about anxiety is that the simple tasks are twice as difficult to do when compared to what I imagine non-anxious people deal with.,"Gotta get ready for the day? What is the step by step breakdown of every task I need to do before I’m presentable...

Gotta make breakfast? What is the order in which I need to make this smoothie...

Got a list of things due at work? What’s most important, did I order that correctly, alright I’m done...is my work good enough...

Ok I’m gunna send a text to this person. Did I say the perfect thing in that exact moment...

It’s so tiring."
Has anyone here ever screamed/felt like screaming from how anxious and overwhelmed you feel? I need someone to understand,"Hi...I'm writing this while I have a small panic attack. Okay so one of my biggest fears is that I'm gonna feel so anxious and overwhelmed that I'm just gonna start screaming. I get scared I'm gonna do it in public or around people that don't understand my situation. And I haven't done it so far. I've always had anxiety but it got worse in the summer of 2019. I know that if I were to scream, I would have to stop eventually and it calms me a little bit but then I get another panic attack and the fear comes back. I feel really lost and like I'm actually going crazy (I know that's just anxiety talking haha). My dad has been a huge help because he also suffered from anxiety/depression so I know I have someone to talk to. He's been my greatest inspiration to keep moving forward. However I wanted to know how other people felt. Any tips or words of encouragement will gladly be appreciated."
My anxiety hurts,"Does anyone ever feel like that? Like just in general, the tension and the tightness in my chest and scattered thoughts and the restlessness... So uncomfortable"
Increased anxiety/ruminating thoughts when your life isn't as busy?,"Does anyone else have increased anxiety, especially ruminating thoughts, when you're not ""busy"" with life and have too much time on your hands? How do you deal with this? I've been seeing a therapist lately and through our discussions about my anxiety she has pointed out that it seems like my anxiety is at its worst when I'm not busy at work, not busy dating people or seeing friends, no extracurricular activities etc.

I used to love the idea of staying home and relaxing but not anymore."
does anyone else wake up with a sense of impending doom upon you?,"it seems like every time i wake up in the morning i momentarily feel like i’m dying or spiraling out of control. i have almost a mini panic attack every time i wake up and then i have to ground myself and remind myself that i’m just waking up and everything is okay - does this happen to anyone else? it’s been very hard to deal with and almost makes me not want to go to bed at night because i know this will happen in the morning when i wake up. 

edit: 
woah. i did not expect to see this post get so many comments and upvotes - although it’s really heartbreaking to know all of you are experiencing this too i feel better knowing i’m not alone in this....this community has helped me a lot even though i’ve just been lurking for a while - i just wanna say thank you all. thanks for your comments and tips and i hope we can all get through this together, i wish all of you true peace and happiness ❤️"
Anyone else waking up with anxiety?,"The second I open my eyes, I wake up with intense anxiety and Its hard for me to breath, Anyone else have this too and does anyone know what it is?"
