Currently at the movies alone for the first time in my life. I’m kind of freaking out with my hands shaking but I’m also a bit proud I’m doing it - going to the movies alone has been something I’d always wanted to do but been too anxious and self-conscious to do,"Okay so it’s in a city 2.5 hours away from where I live so it’s a bit of cheating, as what’s put me off doing it before is seeing someone I know lol, and I am doing it to distract myself from not eating today...but I’m still doing it! I’m still super self-conscious about it but I’m not bailing..yet anyway.

I’m pathetic I know lol, but there’s not many other places I can post about it, so here I am haha

Edit: Thanks for all the kind comments! I really enjoyed the movie and I’m glad I went! :)"
anyone else find they need near constant background noise to help stop anxious/depressed inner thoughts?,"I realised I always have background noise, audiobooks, music, netflix, something on. I especially need this in times of quiet or before bed when my anxious and obsessive thoughts start to eat away at me. I can't seem to be alone with my inner thoughts, I'm not sure if it's healthy or not but the white noise seems to stem the flow and ease my mind"
Hey,"I just wanted to say happy new year to all the people in here who suffer from anxiety. I know it's such a hard thing to get over but we are the strong ones, anxiety can't take us away from our beautiful lives. Just keep fighting with it, we'll see better days in 2020. I love you all!"
"Things that helped me manage my anxiety, maybe this can help you too","I am taking Lexapro and doing therapy, but I also made a lot of lifestyle changes have made a huge difference, so I wanted to share my list. 

1. I went completely caffeine free. It's been about a month. I also was having headaches and issues with my blood pressure, both of which are better. I didn't think I'd be able to do this (was having 3 to 4 cups of strong coffee and 1-2 sodas per day) but I feel so much better off it. I drink a lot of decaf tea and water. The first week was rough (headaches!) but I powered through and stuck with it. 

2. I stopped going on Facebook altogether. The whole ""comparison"" crap and drama, don't need it.

3. I don't watch the TV news. Ever.

4. I am not overweight, but I started exercising. My therapist told me this is a great treatment for anxiety and he was right. I just do power walk videos on You Tube, nothing fancy.

5. I eat breakfast every day now (was not doing this before) and started eating more fruits and vegetables.

6. My therapist told me to do more things that I enjoy. So with all the time I have since I'm not on Facebook so much, I am reading books. Light fiction, nothing that stresses me out. I also have been trying to do some of those adult coloring books, but sometimes I get anxious about what colors to use or if my picture will looks good (ridiculous, I know), so that's a process.

7. I have the Headspace app and do some mindfulness. This is really challenging for someone with anxiety I think. Sometimes you don't want to be inside your head too much. But I have found the Managing Anxiety series to be really helpful, with the noting strategies and just acknowledging the anxious thoughts without judging them or trying to run away from them.

8. My therapist also told me to do things that build confidence. So I try to focus on things I'm good at, because baking a delicious cake or doing a good job at my work does help me feel better about myself.

9. I can't say enough good things about therapy and my counselor. This is the first time in my life (I'm 40) that I have taken this step and it is incredibly helpful. If you're struggling with anxiety, think about it. I started with my employer's EAP (employee assistance program) which offered 3 free sessions, and then moved on to a ""real"" counselor because it was so helpful. Look into if your work has this as an option, it's free! 


Recognize that anxiety management is a process, and not just a switch we can turn off. My instinct previously was to try to run away from it. I hated it and I was mad at it. But now I understand that it's part of who I am, I have to accept that and I have to learn how to manage it. Hang in there, friends. You got this.

Edit: thank you for all the kind comments, and for the gold ❤️"
"I’m finally leaving this sub, best of luck to all of you, wish I could hug every single one of you.","After years of battling anxiety and panic attacks, I am finally proud to say I live a life without excessive anxiety, panic and worry. I started Lexapro and it’s changed my life. I feel as if a weight I didn’t know was there has been lifted off my shoulders. I can finally fucking breathe. People who are in these forums are people who need help, which there is nothing wrong with that. Although, I don’t need help anymore! Tons of people have helped me in this sub and given me great comforting advice. Best of luck to all of you and I hope one day soon you too can leave this sub!!! PM if you need help or have any questions. Much love.

EDIT: You guys make it hard to leave. All of you are so supportive. Anxiety is such a bitch and I seriously PRAY one day you all can live anxiety free!!! Please PM for anything ❤️"
I’m so proud of myself. I just started college. I’m a week in. I haven’t had friends to talk to in person in years. I made 4 wonderful friends and they made me so happy last night.,"I didn’t wanna go to this school party/dance event last night.. I don’t know anyone here. Even in high school and my hometown I never had any friends to talk to in person. For years I was alone and only had a few online friends.. 

I’m so glad I decided to fight my social anxiety last night.. I went to the event. After an hour of walking around and standing in the back, I decided to walk over to this small circle that had formed. People were having fun and dancing around. And I ended up sticking around and then eventually one of them said something to me. We started talking and I met the whole group of them. 

Sorry for typing so much lol. I’m just so happy I finally have someone I can talk to in person. It’s amazing and I had a great night. I’m so so glad I decided to go to the event, despite being so anxious and not knowing a soul. This is a huge step for me and it feels amazing. 


**Update:** **She just asked if I wanted to come to her dorm to do homework, I agreed. But I’m instantly regretting this. What have I done.**

**Update 2:** **It was fun. She’s really nice and caring. Even got a hug. My first hug from anyone other than my parents or family in years. Thank you all so so much for your kind words. You’re all amazing!**

**Update 3:** **I’m beginning to worry I’m gonna make them hate me. I feel like I’m so annoying.. I’ve never really had friends in person, other than online friends, and Ive been texting them a lot. They’ve been busy so we can’t talk in person. Has this happened to anyone else? Your mind and anxiety keeps telling you they’re gonna leave and forget you so you have to talk to them a lot and very often so you know they don’t hate you and you can have a little relief? What do I do?.. 


**Update 4 (probably last update):** They we’re just busy. We hung out last night and watched a movie and had fun. Already have plans for Labor Day weekend. I still can’t believe this is happening. This is the best hint that’s happened to me in 3 years. Thank you all so so much for the kind words. You’re all amazing people. "
Anxiety is trying to stop me from going to a car wash so I’m going to the car wash in an act of sheer disrespect towards anxiety,"As the title says, I’ve got “a case of the spooks” where I feel woozy and dizzy and icky about just going to a car wash. As a kid I used to love going,  but now I find the chemically smell kind of difficult to manage. But the car is dirty and I want to do this. 

So now that anxiety has gotten involved, I want to be rude to it. So I’m gonna go get this car clean!

Edit: we got there and there was a line up of 5 cars ahead of us, so I had to double down on anticipatory anxiety too, but I WON. And the car is very pretty now!"
Remember to drink water. Remember to breathe. Remember to stay off social media.,"Sending all of you hugs and a reminder to take care of yourself and your loved ones. The little things can be the hardest in the face of all these big scary things. Take a deep breath in, and back out.  
  
You are going to get through this. 💙"
"Does anyone have a ""hangover"" period following a high-anxiety/stressful event?","Such as attending a concert, speaking in front of an audience, or anything that makes you nervous?

I used to be fine going to shows, concerts, anything. I liked it.  
But ever since my first ever panic attack I've been physically ""shaky"", even sometimes when I am not even mentally worried at the time.  
It's like my body turned into a chicken.

Now when I attend an event, I sometimes feel stress symptoms.  
Then after the high excitement/stress event, I sometimes get a ""hangover"" period. I feel so exhausted and sometimes hungry.  


This is when the heart palpitations sometimes kick in. I feel my wrist and it's sometimes about every 5th beat, and sometimes about every 20th beat. These heart palpitations give my chest a weird, uneasy feeling. There's this vague but strong discomfort in chest area, to the point where the thought of going to the ER crosses the mind.

Then I go to bed, get lots of sleep, and wake up still tired when slight anxiety-like tremors the next day. But then as that day progresses, it starts to feel a little better.

Does anyone's body feel ""shaken"" after high excitement/stress events where it takes a while to recover?"
Does anyone else dread a new day during the evening?,"As soon as the evening starts getting later, I dread going to bed sometimes because I don't want another day full of responsibilities that are making me anxious to start... I just want the evening of relaxing to be endless. Does anyone else get this??"
I got on stage in front of 600 people to deliver a speech for a public speaking competition... And I won!!!,"## Some Context
I was diagnosed with ADHD in March, that same day I decided to conquer my fear and spoke on stage for the first time in a public speaking competition against 9 other people. I ended up winning! 

A few nights ago, I competed in the Finals for title of *Inspirational Speaker of the Year* and many other amazing prizes... 

And I won! 

## Proof
[1st](https://imgur.com/RWlXuuZ)

Go face your fears cause you'll never know where you'll end up."
"UPDATE TO: This past weekend, I overcame my anxiety and decided to shoot my shot: I asked out a guy I have a huge crush on and he said yes!! We're going out to get coffee soon 😊😊","Unfortunately, getting coffee isn't going to happen as he is currently talking to another girl and said she wouldn't be too happy with him getting coffee with another girl \*sigh\* **😒** **😒** 

I'm glad he told me even though I'm disappointed and I very much respect him, so hopefully we can be friends or something (because I really really like him and think he's super cool) so yeah... that's a thing... "
Are you ok? Leave your user name and I'll check in on you at least once this month and ask you how are you going.,"This is an idea I've been sitting on for about 3 months and now I'm willing to do it. 

I see posts about people having no friends and how making friends is hard all the time and I get it, I'm in that boat too. So I want to reach out to the people who would like a complete stranger to check up on them at a completely random time over the next 31 days.

If you leave your username I'll go through, when I'm bored, and send you a private message asking ""are you ok?""

You can reply with one word, yes or no, or you can spill your guts to me and I'll do my best to give you good advice or at the very least give you a ""Fuck that * insert person* for being such a * insert derogatory name.*""

Ok that is all :) 

Edit: Wow it went from 6 to 56 in an hour, I thought 30 would be a good number but this is also good. Thanks for all your kind words and to be honest I'm getting anxiety from just thinking about sending so many messages to random people but I promise I will get around to everyone by the end of the month. 

Edit 2: As suggested by a couple of people you can absolutely take note of a few users and send them a PM if you'd like. Me included. 

Edit 3: Oh crap, so long inbox, I barely got to know you. I'll just let this die down a bit before I start sending out more RU OK? PM's. But they will come, and when you least expect it, so don't wait on it. I'll be an RU OK? ninja. Striking when you least expect it. "
"If you see this, you better have a good fucking day!","And always remember, fuck anxiety, it’s all energy! Embrace it!


Edit: first silver ever!  Thanks kind stranger. 

I suffer from anxiety all the time. As I’ve gotten older I try to focus on the anxiety as energy moving throughout my body.  If I have anxiety and I feel it in my stomach, I zone in on how my stomach is feeling, pay attention to the anxiety moving throughout my body and it helps to relieve it eventually, don’t ignore it as it’s there for your attention, something about your mental thinking or the physical world is causing this energy to enter your body, find out what it is, pay attention, don’t ignore it."
Worth remembering if you're having a bad day.,"1. Your levels of norepinephrine, cortisol and adrenaline are off the charts. Your fear is a neurophysiological illusion, not a fair representation of the way things actually are.

2. Your anxiety is feeding on your fear. Why are you latching on to the thoughts you fear the most? What makes them feel more true than other, more neutral or pleasant thoughts? Contemplate for a couple of minutes.

3. Is your breathing shallow? Is your body feeling tense? Relax the body and take some deep breaths for a couple of minutes. Be mindful, and wait, with no fear. Remind yourself of the fact in point 1. Take note of the difference now.

4. Let out a deep bellylaugh at all this non-sense."
This is how you can stop cringing at that embarrassing thing you did 5 years ago!,"So a friend told me this and I think it's really helpful.

If you ever catch yourself rethinking something humiliating you did, stop and instead try to remember something embarrassing someone else did.
You probably can't and that's probably the case for everyone else and nobody remembers what you did."
Um hey,"Not sure this is important, but I went out eating alone for the first time! It went ok, I had trouble ordering, but other wise ok."
Anyone always have a show playing in the background to help anxiety?,"For me it started a few years ago when I lived by myself and I couldn't take the complete silence. It just gives me too much free brain space to focus on my other senses. With sounds in the background, it's a bit easier to drown out stuff like heart palpitations or thoughts about how scared I am. I mean, it doesn't stop anxiety and I still get anxiety attacks but it does soothe me to an extent. So if I'm by myself, I have something playing almost all the time, usually from when I wake up to when I go to sleep, but especially at night. I wonder if there's any harm in playing sounds all day long. I don't play it loud but maybe the constant stimulation has a negative effect on the brain. Either way, I can't stop now, I just get way too anxious without anything in the background and I prefer a show with people talking to a white noise machine.

So, anyone do that too? What shows do you watch? I usually just rewatch shows old favorites, and I leave new shows for when I actually want to pay attention. I've been playing Friends and Brooklyn 99 a lot recently.

Edit: This got so many replies! I appreciate everyone who took the time to comment. Pretty awesome that all of us here have the same experience, makes me feel less like a weirdo because my ex used to always be amazed how I can just rewatch the same show over and over for weeks. She accepted shows playing 24/7 but she didn't get it like y'all do :)"
"After months of unemployment due to anxiety and depression, I’ve now landed myself a job","I’ve had anxiety and depression for quite a while, years; it usually creeps up on me but then goes away, it depends on my mindset and lifestyle. Last year I lost my job (lost as in I had no choice but to leave due to my mental health) and went spiralling down, living off my savings which weren’t a lot at all.

Now, I can proudly say I turned up for an interview shaken and paranoid to be working there today and it feels great to be distracted. I can be on my own, I don’t have to talk to people all day and it’s laid back; perfect for myself.

I am extremely proud of myself, although I still have a lot of issues with my mental health I need to address, small steps like this really help everything else.

Thanks for reading :)

Edit: 19 year old guy from the U.K, just for context :)

Edit #2: MY FIRST TIME RECEIVING GOLD, THANK YOU! I’m replying to all comments so I can show my love and support to each person, if you have anything you’d like to say or get off your mind, I’d love to hear it! "
Hello this is an experiment.,"I am afraid to post on social media. This is a test for myself to see exactly what kind of interactions I can have from doing this. I tried this before and deleted it after 20 minutes, so I just want to see how long I can keep this post up before deleting. Have a great day 

Edit: Thanks so much for all of the support! All the comments and messages were very helpful :)"
"To anyone not having a good Christmas due to family,","I'm your family now & I'll validate the crap out of you. Merry Christmas ❤
Edit: if any of you need a friend to talk to, my messages are always open."
I just had a small conversation with two girls in my class AND I DIDNT OVERTHINK IT they were so nice and we laughed a little. And I even went to the board today to participate in my maths class and I volunteered for it!!! And I dont feel nervous I just feel excited and happy and accomplished yay.,It's so weird feeling this way because I was thinking of committing suicide two days ago
It's okay that that cringy moment happened to you in highschool,"It doesn't matter, we've all been there."
Hadn’t Left the house in four years update.,"Hello all, I wanted to give an update on my progress in hopes to maybe inspire just one person to take that first step.  4 1/2 years ago I had a complete mental breakdown due to a number of stressors and my alcohol abuse reaching critical mass.  Prior to this I did suffer from anxiety for years but was still able to hold down a job, have a social life and be a relatively good father to my children.  
    After being house bound for 3 1/2  years I wasn’t able to walk to the mailbox without having a panic attack. I was so depressed and defeated I didn’t see the point in even existing anymore. I felt I had nothing to offer this world so in what literally felt like a life and death decision I reached out for help. I called my local  NAMI (National Alliance on Mental Illness) chapter and tearfully admitted the hell I had been going through.  It felt so liberating just to hear my voice letting some of that pain out. After a half hour or so on the phone, the women kindly suggested I start talking to a therapist via video chat. I did some research and decided on a company called betterhelp. I was assigned a counselor and she helped me to come around to the idea of medication. I then began video chat sessions with a psychiatrist with a company Teladoc. I was prescribed 15 mg (after a gradual increase) of lexapro.  My wife of coarse had to pick up the called in script from the pharmacy. The first two months were not good to say the least, I had a lot of side effects but I pushed through and by the third month i started feeling a little bit of my confidence returning.  I would take little walks a couple hundred feet from the house.  I started to white knuckle drive around the block.  In May of this year at 5 months of medication, on a Saturday morning something in me clicked.  I just said fuck it, jumped in my car and drove a couple miles down the road through multiple stoplights to a Home Depot, went inside and made a purchase. It was TERRIFYING!  I was a nervous wreck but by the time I made it home I was so stinkin proud of myself I was gitty. I came right on here to reddit and announced my crowning achievement. 
     In the time since then I push myself everyday. Little by little expanding my comfort zone.  I now can drive anywhere in the city, I have even taken the freeway to the next city over. I go for walks with my family to the park. I have gone out to dinners and reconnected with some old friends. Most importantly the quality time out of the house with my children has returned me a mindset that I do have value, and I do have something to offer this world.  I still have down days but overall I am happy and proud of the progress I have made.   
    For me the combination of medication and cognitive behavioral therapy has proven to loosen the chains of anxiety but none of this would have been possible without taking that very first step of many first steps,    Asking for help!   From the bottom of my heart I wish all of you the best."
Does anyone go over all the stupid and awkward shit you’ve done in your head over and over again?,It’s one of those days I guess. I’m beating myself over stuff that happened years ago for some reason today.
I made a HUGE breakthrough today!,"I have a huge huge huge issue with doctors and being touched in general due to a sexual assault in the past, but I am really behind on my health and was overdue for a lot of things. I finally went to an ob/gyn for an annual checkup, and I was okay! I did it! I went through with the entire exam without a panic attack even though I was shaking and crying even thinking about scheduling an appointment. I'm so proud of myself and I hope I continue to fight through my anxiety and past traumas as effectively as I did today.

Edit: Thank you guys for all of your support. This sub is amazing and You all have helped me so much. I responded to quite a bit of comments in the beginning but it's takes me a while to respond and I'd spend too much time replying to things. If you want to talk you can message me. Thank you all so so so so much and I love you. love And thanks for the gold and silver!"
Honestly not wanting quarantine to be over,"I haven’t done anything social since covid started and I’m loving it. I hate parties, I hate social events so the fact that I like almost legally can’t go to any is great. Our state just okayed social gatherings of <10 people though so immediately my boyfriend’s friends decided to have a fire and invited us. 

I’m having an absolutely awful anxiety day - I’m guessing the fact that it’s tonight is primarily causing it, and I don’t want to go at all.

Is it normal to want to be by yourself this much? It’s been almost 3 months of quarantine and I’m still not socially rejuvenated."
Have you guys been crippled by your anxiety so much that you just don't do your assignments?,"Hi,

This is me. Worrying about my assignments just makes me stay still and not do anything.

Not doing anything leads to even more anxiety and more anxiety cripples me from doing anything. Its like a shitty negative feedback loop. 


As a result Im actually failing this unit lol. Every assignment has been handed late due to cripplying anxiety. 

I even got a fucking extension and I am way past THAT due date as well. 

God everything fucking sucks."
Who else has anxiety about not doing enough with their life?,"To give a brief backstory, I graduated college in Spring 2017 and was still working as a barista at Starbucks. About two months after graduation I started to really feel the effects of my anxiety. I was panicking that I didn’t already have a better job and that I was gonna lose my apartment because I couldn’t pay bills. After relentlessly searching until February 2018, I found a job as a sales rep at a cell phone store. Since February, I’ve been doing great! I’ll be making about $40k a year and after five years of struggling with bills, I can comfortably afford my apartment!

Now, since about April, I’ve been having anxiety, again, about me feeling like I’m not doing enough. I’ve been relaxing a lot, going out to places with friends (because now I can afford it,) and playing a lot of video games(it’s always been a hobby.)  But I’m feeling pressure to go back and get a masters in the hopes of finding a better job and really going for something that I actually dreamed of doing. I just can’t find the will to break away from this relaxed mood the change in pay has given me. Every time I try to give up playing video games and going out with people, in hopes of working towards something, I go right back into this comfortable routine. 

Does anyone else feel this way/get anxiety about this? If so...does it go on forever? Will there ever be a time that I feel fully, 100% relaxed and comfortable with how I’m surviving and doing things that make me happy?"
I'm defending my master's thesis before a jury in approximately 1 hour.,"Heart pounding. Shortness of breath. Dizziness. 

They are all here .. but fuck them. 

What do we say to anxiety? Not today.

Edit: I tried to answer all of your comments. Thank you again. Hope you all have an amazing day!

Edit 2: Thank you for the gold! :)"
