Why can't there be an easy and peaceful way to die?,"I've wanted to kill myself for a while now, but I'm afraid of suffering or being in a panicked situation even if it's only for the brief moment. Why are the only options inhumane methods? It's so stupid that society is against assisted suicide, especially because what's the harm with it? Some might say it's unethical, well it's also unethical to force someone to kill themselves inhumanely... I hate this. "
“I’m always here if you need to talk”,"I appreciate the programmed sentence you feel obligated to tell me, so you can feel better about yourself. 

The reality is, so many people can you tell you there here for you - but they’re not, I’m sorry but they’re not. 

I don’t feel comfortable telling anyone “hey they’re back, the thoughts are back and they’re stronger each time” 

I couldn’t even tell my therapist the truth depth, I can tell her I have thoughts sure, that they linger - always. If I tel her, I get “you’re not going to though, right” - it feels like a trick question. What relieves them though? I meditate, I journal, I do yoga, I exercise, I have lovely friends and family, I take my meds, I drink water - but they’re there. 

When does it end?"
...,"Feeling unappreciated. 
Like people won’t accept me for who I am. 
That I’m uninteresting and a burden.

I’m tired of acting happy.
I’m tired of living.
I want to leave... but fear stops me.

I don’t want to hurt my family.
I don’t get treated well.
Emotions hold me back.

Nothing excites me.
My future ambitions are gone.
I love sleeping because it’s the closest thing to death.
 
I’ve started working out, eating healthier.
A lot of things I want are given to me.
I’m thankful for all of it, but that won’t save me.

I just want love.
From anyone. 
A family member, perhaps a friend or stranger.

But I feel that even if I find love it won’t be enough.
When will I ever be satisfied?
I guess I’m stuck here until natural events are the end of me..."
Listening to music while drunk is amazing,Hopefully I won’t wake up tomorrow
"Does anybody actually wake up every day thinking ""wow I can't wait for another one""?","It's just day after day of agony, I can't comprehend that people actually enjoy it."
My experience with “reaching out”.,"Ppl: “People need to reach out when they’re feeling suicidal. There’s help available out there. You matter!”

Me: *reaches out*

Ppl: “Omg you’re just looking for attention lol stop being so overdramatic.”"
The suicide hotline saved my life last night,I was very nervous about calling but I don't regret it at all. Amazing resource
"We euthanize pets when we think they have no more quality of life left and it’s deemed the “responsible” thing to do. But when a human knows their life and that they have no hope left, suddenly everyone becomes the expert on “suicide is selfish and there’s a chance things will get better”",I don’t want to live out the next 50-60 years of my natural lifespan in pain waiting for the day to come so I just want to take matters into my own hands now and save myself the suffering. I don’t need judged and told to hold on because things “might” improve. My life has had 17 years in it. Plenty of time to live it and know it’s never going to get any better. If things were ever going to get better and my life was going to improve then it would’ve happened by now
"My girlfriend committed suicide, and I'm worried I'll end up doing the same","My girlfriend of over 5 years committed suicide a few days ago, and I feel like I'm fucking dying inside. On one hand, I feel so much emotional pain that it's killing me, but on the other hand, I also feel so numb and empty and lost. I can't process it.

I wanted to propose to her. The worst part is that the reason she did it was because she was being sexually abused by a ""friend"" of mine for years, but kept it a secret from everyone because she was being blackmailed by him. 

I feel like it's my fault. I should have realised. I should have stopped it from happening. I can't believe I let that piece of shit anywhere near her. I feel so much guilt that it's driving me crazy.

My head is a mess. I haven't left the house for days. I haven't spoken to anyone. I've been ignoring all the phone calls and text messages from my family and friends because I can't bear talking about it because I don't want to acknowledge that it's reality. I haven't opened the door to anyone who's tried to come and visit me.

I can't sleep properly, I've practically been starving myself. I just keep thinking that I wanna die. In the shower, I wanna drown. In the kitchen, I wanna take a knife and just end it. I can't take this feeling. I just want her back, I love her so much, and I don't know what I'm going to do without her.

I hate everything right now. And that evil fucking son of a bitch is probably gonna get off free and not even gonna go to prison because I don't have any good evidence. 

Everything's just a mess, and I feel like I'm not fully in control of my own actions at the moment. I don't want my family to find me dead, but I feel like it's what's gonna end up happening if I can't get my shit together. Sorry for the long post "
It’s just sad because the only thing I see in my future is eventually killing myself.,"I am just imagining doing it now. It sounds so nice, peaceful. I just want things to be quiet. Somewhere beautiful. 


I won’t kill myself today, and not tomorrow.
I know that killing myself means hurting my family. I’ve seen how suicides affect people. 


But I’m in so much pain. I’m 4 days clean from cutting. The mental and physical pain are so much sometimes.

Anytime I’m feeling something other than sadness or depression I know it will fade.
I feel like i see the world for what it is when I’m depressed. I’m more creative when I can think.


Idk I’m just kind of ranting.
You guys don’t need to send me to someone to talk. I’m okay. Today’s my first day of being on a new antidepressant so eventually I will get better.
I am seeing a psychologist though I think I need to talk more often to them."
Must feel amazing to not want to kill yourself at least 5 times a day.,"I don't even remember what a normal life feels like after starting this beautiful depressive journey in October 2017. Some of you are so unbelievably strong that you are still here after eternities of pain.

&#x200B;

Also blows my mind that there are people out there who don't want to kill themselves at least 5 times a day. 

&#x200B;

&#x200B;

rough life, eh? "
On having no friends in your 20s,"The schedule is always the same: you work 55 hours each week and work out 15 more. You eat takeout at your desk. You stare – blankly – at others from whom you feel depersonalized and disassociated. They stare back. They glare back. They retch and recoil. You go home and eat more takeout and stare some more – at the wall, at the ceiling, out the window. You watch the world turn. You regret. You speak to yourself and diagnose yourself and add and subtract and divide and grind your teeth and lament and-

Nothing changes. You stare down and seek reprieve in the rug. You hug your knees and smoke a hundred cigarettes. You exercise again and read a little. You return to work and lie about your weekend plans and your mental health. You hope and dash those hopes. You wait and pray. You shower too long. You eat too little. You never sleep.

You resolve. You plot. You choose the tools. You cradle them and know you can end it in minutes. You cower and retreat, and it comes in waves and you attempt again but flee again too. You cannot tell anyone. You cannot hug anyone. There’s no one to hug.

Your parents and grandparents age. They inquire ceaselessly after your condition. You lie again. You say things are fine, the social life survives, you enjoy work. You enjoy nothing. You drink. You smoke. You masturbate. You cry some more.

Nothing changes. Spring fills fragrant the air and summer brings its heavy trod. The autumn wind bites and the weeks stretch on. The days grow longer then shorter again. The walk is the same. The work is the same. The nights are the same. The sun and moon and stars and horizon are the same. You are the same.

Nothing changes."
stop trying to fucking guilt trip me,"*“your family will be so distraught if you hurt yourself!!!”*

*”you have NO IDEA how much of an impact suicide will have on those around you!”*

*“imagine the reaction of your parents! imagine them reading the note! receiving the call!”*


....



wtf,,,, i know you have good intentions but *please*

is this really supposed to make me feel better? 

all it does is fill me with guilt,,, and fills me with the realization that i have to live in fucking pain until the day i die,,, or until everyone who “cares about me” will die."
I understand suicide,"I'm starting to understand people who commit suicide. It's like, when you know you have the rest of your life to look forward to but you look at your life and just can't imagine living it every day, year after year. You have people tell you it gets better but it's been years and it hasn't so it probably won't and you're tired...so tired. You just don't want to fight through the day anymore. I think when you commit suicide it's with the knowledge that there will be people hurting once you're gone but the idea that your pain will end may make it seem worth it. Suicide is indeed selfish but, perhaps for some, they have to be selfish because for years they put everyone else first. Always gave and gave and gave and no one bothered to see how they were...how they were managing...if they were ok. Maybe they were sucked dry by life and just couldn't take it anymore. For some, life is fleeting and they live it to its fullest...they enjoy it and love it...but for others...its so long...never-ending...painful. Being alive and living are two different things. Maybe some people who commit suicide actually died a long time ago but the people in their lives were so busy taking, they couldn't give a minute to realize. Death is funny like that; it's not always on a physical level. 

I have struggled with my depression the majority of my life. While those I care about thought I've gotten better, the reality is, I've just gotten better at hiding it. There are nights that I lie awake dreading waking up, living the day that just ended again, over and over. It's a cycle that never ends...nothing ever changes. Nothing good is sustained. Life just continues tomorrow exactly the same as it was today. Every bad decision plagues me and losses I've suffered haunt my thoughts. On the rare occasion I attempt to reach out, I know I will mostly be met with half hearted attempts to listen or understand. There is usually only a distracted silence on the other end of the line. 

Night before last, while lying awake, I realized I understood people who committed suicide. That scared me. I am in a dark place and I have never felt more alone in my life. This is a time where I could have used the most support. At this time I no longer feel capable of maintaining relationships. It's taking so much effort and I need to put everything I have left into my children. They have to be my primary focus and I'm just not sure I have enough in me to be a good mom and daughter/sister etc."
Why are ''I'm gonna live''-announcements allowed here?,"This post is not meant to target anyone in specific, I see this really often in this subreddit, and it just got me so upset. People who come to announce here ''fuck depression, I have decided to live'' or ''I'm leaving this subreddit because I'm better now'' get the most karma and thus, visibility, although here are posts HOURLY about how someone's gonna do it, or needs someone to talk with. Who am I to say about who needs more attention, but in my opinion, it's the people who are struggling.  
Also, maybe it's just me, but these ''positive'' posts make me wanna kill myself even more. This makes me sound like a bitter piece of shit, and maybe I am just that. These ''uplifting'' posts are probably meant to be motivating and so on, but I just can't see or feel it. So please don't get me wrong, I wish everyone could live without suicidal thoughts, I wish everyone well, I wish no one felt the need to be in this subreddit. It's just really, really hard to feel happy for those who ''just decided to live'', when I've been fighting my suicidal thoughts over half of my life, and know it's not gonna get better before I'm finally dead.  
I'm sorry if I got anyone upset with this, that wasn't my intention. I wish I could die already, and not be such a whiny nuisance."
So the suicide hotline just hung up on me. Twice.,"I have no one. Having a breakdown. Called them for the first time ever. Apparently I wasn't suicidal enough. Fuck me, right?"
Suicide Hotline hung up on me,I told them everything that was happening and that I don't want to go on and they said sorry we couldnt help you and disconnected. Are you fucking KIDDING ME? Like I was placing an order at Taco Bell. I feel like they answered my problem right there. It's a good thing I don't have my pistol. Fuckin hell. How can you claim to help anyone suicidal with resources that can't help people? Now I want to run headfirst into traffic. 
This sandwich doesn't taste good.,"It doesn't. Bizarre as it is, this sandwich just doesn't taste good. It doesn't really taste like anything at all. It should, though. It's got bologna and salami and mustard and cheese and mayo (well, miracle whip actually. I'm a heathen of sandwiches). Tons of flavor. I used to love this sandwich, and I'd eat it while doing things I loved to do. It was my gaming sandwich, my movie watching sandwich, my writing sandwich, my singing sandwich. I think the only thing I never used this sandwich for was foreplay. Mustard stains on the sheets would kill the mood.  


Probably should post this on my throwaway account but...meh?   


I guess it's not just the sandwich. On my other monitor, I'm rewatching Dragonball Z for the umpteenth time. Majin Buu is paused, looking like an idiot. I love Dragonball Z. Watching it is supposed to make me happy. Same with everything else I've tried watching for the past two days...West Wing, Pacific Rim, Jurassic Park, Freakazoid. Temporary distractions, which is good, but ultimately they just aren't giving me any pleasure anymore. Nothing is.  


I'm so exhausted. I've been exhausted for weeks. But sleeping is terrible. All I do is lie there and think about people I've hurt, friends I've lost due to ways I've treated them. There is no atonement when they don't even speak to you anymore. I catch glimpses of them -- accidental Snapchat stories and things like that. I look back on old photos we had and video chats still saved so I can hear them talk to me again. It's a common fallacy in the world that somehow ""taking responsibility"" for your actions makes everything okay. I almost wish I was ignorant to my own wrongdoings -- right now, I'm just furious and guilty and there's nothing I can do about it. So I lie there, listening to white noise or comforting ASMR videos to try and keep my brain at bay. Usually though, I'll end up lulling myself to sleep thinking about the different paths of communication after my death. Who will get contacted first, based on which methods and which scenarios? How will certain outliers in my social circle find out? Who will be mad, who will be devastated?  


I never intended on posting to this subreddit. I've lurked here many times when I was feeling suicidal, and I'm not exactly sure why. Reading about other peoples' suicidal ideations is certainly no way to make myself feel any better. And typically, I'd actually feel worse for being in my mental state when I'd read other peoples' stories. Stories of abuse, abandonment, mistreatment. The worst the world has to dish out, that's what would send people to this dark place in their dark times. Me? I'm just...weak, I guess.  


I've been fighting off my own death since I was 14-ish. I've attempted suicide a handful of times already. I was a cutter as a teenager, then I moved to more drastic attempts. Had to be talked down from an overpass once. My most recent flirtation with death was an intentional overdose on my Klonopin prescription, March 2017. That was the closest I've gotten to death. Right after I did it, I called my mom. I wanted to die but...I was still scared. I was sobbing on the phone. When she realized what I'd done, she got the paramedics to my apartment. By the time they arrived, they had to break in my door. I'd lost motor function. I vaguely remember the phone call, and I vaguely remember waking up in the hospital.  


Anyway. This sandwich doesn't taste good. Life has lost its flavor, and I'm exhausted from going rounds with myself year after year.  


In November 2017, my life broke down. Hard. I had been living on my own, in Vegas. I had a great job with a great company, making decent money. It was stressful, hell yeah, and in a micro-view I was unhappy. But if I looked at things in a macro sense, I was doing great. I had a dog and a ton of close friends and even though at that immediate point in time I was working bananas hours, I was hopefully working towards a new promotion. I had goals. I was really trying. I was seeing my primary physician, my psych, and a weekly therapist. Everybody was on board with my mental health. I was diligently taking a new batch of prescriptions that seemed to be working. My therapist and I were several months into the process and I felt comfortable talking to her. I was playing by the rules and life was supposed to work out.  


So, then it all just went poof. I broke down. Stopped going to work. Stopped talking to anyone. Just, abruptly, one day. Didn't show up, didn't call. My brain led a savage counterattack, like it was actually demanding retribution for my happiness. I hid in bed for a few days and then randomly drove out of the state, posting nonsense to Facebook. Eventually my closest friend finally got through to me and talked me into coming home. I returned, but nothing changed. I lost my dog, gave him away to someone who could take better care of him than I could. I went to be with my parents in Ohio to try and sort myself out. Stayed there for about a month. Visited family. Tried to re-center myself. Same closest friend flew out on her own vacation time and helped me make the drive back to Vegas in January.  


Got back to Vegas. Walked into my apartment and I realized -- absolutely nothing had changed. I was still jobless, and most of my friends were mad at my abandonment. And that's not to paint them in a bad light -- not at all. I'm saying, these friends had been previously literally knocking on my door and getting ignored. Calling, texting, trying to reach me, and I'd blown them off. Their frustration with me was out of a place of self-preservation. You can't help someone who won't help themselves.  


And that's exactly what happened. All through January, I stayed holed up in my apartment. I burned through most of my savings, just ordering disgusting amounts of delivery food every night. I neglected my bills. I didn't care, at all. I let my living space turn into absolute filth and waited without emotion for the day to come when I was evicted and had to live, and eventually die, homeless and alone. It was fine by me. I just...I felt like I had been switched off. Whatever drive and instincts had previously kept me going were severed and I was just drifting along the current until I washed up on some metaphorical beach and died.  


Lots of other weird stuff happened during that period. I insulted people, I hurt people, I did things I regret. I think I may have caused that close friend's cat to die. I had some sort of other person or personality ""take the wheel"" for a few days. It's all kind of a blur.  


But eventually that same closest friend showed up at my door and refused to leave. Eventually she got me to open the door, and basically forcibly dragged me out. She took me hiking. I saw sunlight for the first time in a long time. I had real face-to-face conversation and then we had lunch, something other than Chinese or Dominos delivery. We got back to my apartment and she spent a couple hours with me cleaning the place up. Dozens of garbage bags, filled with old boxes and rotted food, and all of the old toys and mementos of my dog that I'd still been holding onto out of denial. We wiped down counters and started laundry, vacuumed and straightened. She took me to the grocery, bought me real food with actual nutrients. She did a one-woman barn raising.  


She left, and the message was clear: \*you have people who love you, but you have to help us help you\*.  


I didn't.  


In no time at all, I was just as withdrawn as before. Even being slapped in the face by compassion wasn't enough to kick-start my desire to live, to fight, to survive.   


My father showed up one day. I let him in. We started packing my belongings. The movers showed up. We sold my truck. I tried to hold my head high as I said goodbye to my friends one last time.  


""We'll see you in a few months dude.""  


""It's just a temporary thing. You just need some time to figure yourself out.""  


I knew it was lies. I knew even then, I wouldn't see these people again. I really did love them all, they'd been my friends for years and years and years, through times very similar to this one. But I knew this was different. It felt different. Because it didn't feel at all.  


I drove back to Ohio with my dad, and I did my best to make it a fun roadtrip for him. My mind was swimming and I really didn't remotely care about taking a road trip, but I knew he was excited so I tried to fake it for him. When we finally got to the house, I hugged my mom. She was so happy to see me. So relieved. It's got to be absolutely unbearable when your child is two thousand miles away and sick in a way that you can't help. I took my suitcase upstairs, and sat on my childhood bed.  


And I sobbed. I sobbed tears that hadn't wanted to come out for months. This was supposed to be a way for me to start over, but I knew deep in my core that it was the end. I looked at the four walls of the bedroom of my youth, and knew beyond a shadow of a doubt that I was already dead.  


That was early March. Here we are, nearing the middle of July. I still tried, to be honest. I tried, despite having no desire to do so. I tried to find solace in my family and I tried to rekindle my love for music. I joined a band. I started posting my own solo projects online. The band thinks I'm great, and the solo stuff I've posted to /r/makinghiphop has gotten pretty positive reviews so far.  


And none of that matters.  


I've never thought to myself ""the world would be a better place without me"". No, I'm fully aware that I bring joy and light into peoples' lives. I'm funny. I'm talented. I'm smart. I'm not half bad looking, either, when I take care of myself. Honest, I know all of that. I just...I don't \*care\*. I'm so exhausted. I'm so done. It's going to be in the next day or so. There are train tracks not too far from my house...I'm just going to park nearby, and start walking along until I can hitch a face-first ride to the afterlife. I can't fight anymore. I can't keep living life where I cry so often, and feel so empty and so guilty. I can't just sit here in my parents' house with no job and no purpose. I'm exhausted. I'm all out of fight.  


This sandwich doesn't taste good."
"I want to kill myself so I don’t have to work, I have a hard time keeping jobs..","Hello, past a year or two I been having a hard time keeping a job. I just ether don’t like the job, the people there, I feel like I’m always doing something wrong, I hate waking up and wasting my whole day there.

I don’t care about money like really I rather live on the streets or just be dead but my parents keep telling me the same stuff over and over, saying how “Everyone hates working” or “what do you expect to do in life, just sit in our house forever doing nothing” or “that’s life for you, man up stop acting like a kid your a adult now”..
I have a job right now, but honestly I just want to quit.
I managed to keep this job for 3 months but I don’t know what I’m gonna do,All I think about is I’m
going have to work everyday of my life and I have a hard time making it thru one day.. A day feels like for ever, idk everyday it feels like Its my last day.
I just hate living since I can’t function like a normal person for some reason it seems like everyone is able to do everything better then me and I’m just a mistake..
I’m on antidepressants they helped me to get the job I mentioned and probably why I stayed so long but there not helping much I think my depression got worst but idk..

So for rambling I’m just so lost right now in life.. I’m 19 btw"
Nobody fucking cares before you have actually done it,"but then, it's too late to care anyways. Care for one fucking time, ignorant dicks"
