My girlfriend killed herself a week after we broke up,"Hello. I don't really know how to start this. I guess I'll tell you how I met my ex.

Roughly 2 years ago, I was a patient in a psychiatric hospital. As a side note, I've struggled with depression for most of my life, and have had alcohol dependency issues for many many years. While I was in the hospital, I met this girl. We talked a few times, and she told me that she was being treated for depression also, though she didn't seem very depressed at first. She told me stories about her ""previous life"" as a med student, and how she failed out of med school. I found myself drawn to her charms. Not much later, she left the facility because the treatment wasn't working for her. I gave her my number, and she texted me that same day. For 2 weeks, we would text all day, talking about everything; mostly how bored we were, she with her life at her apartment all alone, and I with the therapies. We realized that we really liked each other and went out on a date. Then another, and another. I was so happy to have found someone who understood the things that I had been going through. We were a couple before we even knew it.

Things were still difficult for both of us, but they were near perfect when it came to our relationship. I got discharged from the hospital and started focusing on healing myself before looking for a job. She was supposedly doing the same thing. She came over often, to the point where she would need to ask her mom to look after her cat while she was with me. She met my son. Things started getting more and more clear to me though. She slept a lot. And I mean A LOT, up to 18 hours a day. She was bored all the time. Thinking about finding a job gave her anxiety. There were days when she'd lay in bed all day, get up to do something, and then get an anxiety attack and need to get back in bed. I won't say that it wasn't somewhat tough on me too to see her like that, but I always hoped for it to get better. She'd have good days where she would meal prep for an entire week for the both of us, or make 3 paintings, or talk about going back to school, but it was the minority of her days. I loved her though, and despite her depression she was sweet and caring and funny, and she got along great with my son.

After a year or so, I decided that I needed to start looking for a job. I found it so quickly that I was kind of stunned by it, but happy, of course. She was really happy for me too. I enjoyed my job at first, but found it pretty stressful, even from the beginning. Months passed, and the stress started building up. I started drinking again. Small amounts, at first. I tried to hide it from my girlfriend, but she caught on pretty quickly. She tried helping me. I wouldn't let her. The drinking got worse. I'd come home from the bar late at night to find her waiting up for me, and we'd argue, which I usually had forgotten the next morning because of how drunk I was. She told me that I shouted at her, insulted her, made her cry. I'd be so ashamed, ask her to forgive me, to please please please give me another chance, promised that I would stop drinking. And I would. For a while. Then it would all repeat itself again.

One night I came home late again and we did the same old routine. The next morning, I found her in the garage with her bags packed. Said I had said all kinds of nasty things to her, as I had so many times before. But this time was different. She told me that I had said I didn't give a fuck about her. That I wanted her to leave. And when she started sobbing, I shouted at her to sob less loudly because I couldn't hear my music. I couldn't believe it, I just couldn't. At first I thought she was bluffing about leaving, but when she started silently crying I knew I had fucked up. I told her, of course I don't want you to leave. And then I begged her to stay. Her mom eventually arrived and took her away.

I tried calling her so many times, on her cell and even her parents' landline. I got her mom on the phone once, and she confirmed that she was there, but she didn't want to talk to me. 

One week later, I got a call from her sister. She hanged herself. She apparently left a note, saying how lonely she was, and how I had been her only friend. How terrible it was to hear from her only friend that he didn't care. How it had been the last straw.

I feel sick even writing this. I killed her. I killed the woman I loved. I've been sober for 5 months now, but it's not enough. It's never going to be enough. I feel so guilty. I miss her so much. Lately I've been feeling suicidal again myself. All I want is to be with her again. If I could only tell her how sorry I am. But I can't.

Thanks for reading to the end."
Raped in front of my girlfriend. feeling like giving up.," 

I don't know what to say or do, I just feel like my life is falling apart.

Three weeks ago My apartment was broken into by 4 strangers, my girlfriend was sleeping over. It was an awful, horrific long night, and she witnessed every single thing. 8 hours of prolonged humiliation and abuse.

These 4 strangers destroyed me. They shredded every bit of self-esteem and sanity I had. After the hell they put me through, they simply left me there. bleeding heavily and stunned. My girlfriend was tied up screaming, but I didn't move. It took me a while to comprehend that this is now my reality and eventually get up.

Weeks later, I am paranoid, unable to look at my reflection without feeling disgust, and I spend my time in my university lectures thinking about ending my life. I didn't tell a single soul about this because I feel so ashamed. I feel pathetic and weak. My girlfriend is the only one that knows, though everyone around has been telling me I've been ignoring them lately and calling me an asshole for it, yet I don't care. I just feel numb. I want to die, but I'm too afraid to say it out loud. That night they not only violently violated me, but they took something from me, a piece of my soul.

Anyways, ever since that night my girlfriend has been acting different. she treats me differently, touches me differently, and most importantly she looks at me differently. A few days ago while we were sitting together, she told me that it's alright if this experience turns me ""gay"" and that we don't have to continue dating. this is coming from a 19 year old girl that has common sense, it all just made me feel really bad. It just reflected how after all this, how disgusting I feel was valid, that I am gross in her eyes now.

Today is my birthday, I turn 20. I bailed on all the plans and decided to spend it alone. I'm sitting at home drinking alcohol and thinking about bashing my goddamn face in. I just feel alone in a way I never felt before. I just never thought this is where I'd be, that this would be my life.

I hope I'm posting this in the correct place, I've only had Reddit when I was younger. thanks for listening for whoever is out there. Hopefully I'll feel better for writing this.

UPDATE 1:
Two of the assailants were caught by the police today. I’ll post a more detailed update in the next few days. 
Thank you everyone for this support.

UPDATE 2:
sorry I’m late with this, I’ve just been going through a lot. I’m gonna try to give everyone a bit of closure on everything that’s went down. 
The four assailants were part of a sex trafficking gang that my shitty dad got involved with and owed a lot of money. I’m not comfortable sharing the details of this specific aspect, but I hope this general explanation is enough. 
Two of them were caught and will be most likely going to prison as they plead guilty to avoid a trial. 
I’m currently trying to get myself together, but things have been getting worse and worse mentally. I’ve been going to gym, jogging and trying my best to not lose it, I didn’t start therapy, but I’m considering it. 

Me and my girlfriend broke up and there’s no bad blood. I just need to focus on myself. 

And again, thank you everyone for the immense support you’ve given me. You have no idea how much it saved me and made me feel a little less alone. Thank you."
i swear to god if there's an afterlife i'm gonna be so pissed,"if i go through all the fucking trouble of coming up with this shitty plan just to wake up on some couch in hell wih satan being life ""enjoy existing forever"" imma fucking beat his ass"
Just called the suicide hotline,"... and was asked to please 'watch my language.'

The actual fuck.

Yea, I have a mouth on me. Yea, I have an attitude problem. But how the FUCK you going to work at a suicide hotline, even the fucking graveyard shift (heh -- suicide hotline; graveyard shift -- heh), and tell callers their language BOTHERS you? How you gonna LET that language bother you? It's WORDS, you fucking TWAT-NOZZLE. It's a HURTING HUMAN expressing herself.

Jesus fuck."
throwing away my blades today,"been self harming since 12, i’m 22. 

i’m 3 days self harm free.

going to throw my blades away today and fight the good fight.

wish me luck, fellas"
I’ve seen child porn on the internet. I will never be the same again.,"I saw it on twitter. Multiple accounts. I cybertipped them all. There were so many videos. After a while I lost my head and I had to stop. I couldn’t report anymore accounts. I didn’t want to look at them. In the process of reporting one of the videos I thought I accidentally lost the link and freaked out at the thought of having to go back to copy the link again. I will never be the same. There is true evil in this world. I don’t trust men or women anymore. Everyone is a monster. There were so many women in these videos. So many. For a long time afterwards I was paranoid I was a pedophile, a freak, a creep for having seen them, although I am a bisexual woman who has only ever been with people my age or older. I feel just as bad for having seen it. I feel immense guilt for tapping out and not reporting every single account. I just could not watch that shit anymore."
Not a single person actually cares unless you kill yourself,"If you say you're so depressed you can't function it's ""Aw it'll get better"" and they forget about you. Then when you kill yourself everyone's like ""Oh I never would've thought, I wish he would've given some sort of sign.""


I said how many times I want to kill myself and I think I might do it, but I know if I do people will act like it's a huge surprise.


I've been serious all along. I have a rope tied into a noose in a box in my room, so that it's always ready. I'm not joking or just looking for attention when I tell people I need some kind of help. Everybody only pretends to care and then when you're dead tries to say they cared all along"
I wish I could swap places with a person who died that wanted to live.,"There’s so many people in this world who wanted to live, but died too young in a cruel twist of fate. Cancer. Car accident. Murder. I feel so selfish that I’m still here instead, when I don’t even want to be. If I could swap places with a person like that, I’d do it without hesitation. At this point I’m only alive out of a sense of obligation."
"I am never ""suicidal enough"" to be heard. I am too well-dressed, too articulate, too friendly ""too"" everything to be worthy of any support.","And I am gradually withering away because of it.

Mental health professionals never take me seriously. I can see it in the hint of amusement in their eyes, their disengaged body language, their patronising tone of voice. They say I'm ""too"" well-dressed, ""too"" articulate, ""too"" intelligent. I am ""too"" kind, I smile ""too"" often, I'm ""too"" calm.

This has not only been offensive to me, but it is such an insult to people who are mentally ill and suicidal. Their implication that suicidal people are dumb, frenzied and rude slobs was - and still is - fucking preposterous.

I have tried to get help for approximately 8 years. I have begged and pleaded and been reduced to tears. But unless I'm trying to end my life right now in front of them, it doesn't matter. None of it matters. I don't matter. 

My public face is ""too"" convincing. But this was carefully created and crafted, over many years, because I had no choice. I had no option but to hide the abuse and isolation and pain I have suffered behind a smile. I was never given an alternative, and when someone glimpsed the reality behind this façade, they did nothing.

The truth is, a part of me is frightened of dying, and my survival instincts kick in when I don't want them to. But that doesn't mean I want to live, either. If I could switch off this deeply ingrained fear and just be done with it, I would. 

Why do we have to kill ourselves or almost die before people care? Why do we have to present ourselves in a specific way before we even get listened to? Why do they wait until every glimmer of hope and willingness to live has been stamped out? I hate this. I hate my life. I hate myself. Let me be what they want me to be, please.

**EDIT:** I never ever _ever_ consider others as ""dumb, frenzied, rude slobs"" by the way. I'm so sorry if I made anyone feel that way. It's simply how I interpret the reaction of mental health professionals, when they say ""But you're so clever/hygienic/pretty/well-groomed"" etc. It feels like a slap in the face, as though suicidal people are looked down on if they are well presented, and looked down on if they are not, too (but the latter apparently ticks more boxes from their point of view).
If someone is unkempt, hasn't showered, is visibly distressed or less coherent, I do NOT judge them or advocate doing so. _But using someone's appearance as a way of invalidating their pain? That's **completely** wrong._


**EDIT 2:** Thank you everyone for your supportive comments and sharing your experiences on this subject. It means a lot to me and although it is awful that this resonates with so many people, it also brings me comfort. I am sorry for not responding to everyone yet. If you have had a similarly invalidating experience, I am so sorry. I appreciate the difficulty internalising this, but it is _not_ your fault. You are not to blame for the misconduct of any medical professional, who ought to know better than to belittle us during our darkest and most vulnerable moments.


In positive developments, the crisis team visited me at home this evening. Both mental health nurses listened to me, emphasised that the way I was treated for the last 8 years was unacceptable, completely validated my feelings and showed a lot of empathy. It has restored a little bit of faith in the NHS. They are going to report back to the psychiatry team and recommend that I be allocated a Care Co-ordinator, who will be able to assist me with being prescribed the correct forms of treatment and provide support with finances and social connections. I have not allowed myself to anticipate too much, but I cried with relief after they left. I hope they keep their word. I hope they meant it. I desperately just hope. Until I receive an outcome, I will sincerely try to stay alive. I am not in a position to promise that I will survive, but I can promise that I will try, one more time."
I hate how people dismiss us when we openly say that we are suicidal but when someone keep quiet and kill them selves people be shocked like “They never said anything I didn’t know” WAKE TF UP AND LOVE ME STOP DISMISSING HOW I FEEL,"My parents kicked me out for being suicidal, now a family friend killed himself and they are all suffering not knowing why because he was relatively “happy” and had a good life... Meanwhile my mother while I was panicking she handed me a knife."
"I receive two messages a day, one that my phone is at 15%, and the other that my phone is at 5%.","edit: Thank you for the kind words everyone, each and every one of you brightened my day a bit. Also GOLD HYPERS!"
