How the fuck do you hold conversation?,"I have this problem where I can't really make any new friends thanks to me, failing to hold conversation. I'm sick of relying other people to be very talkative and just responding with filler words. Ive been stuck with the same friends for years. Don't get me wrong I'm thankful to have them in the first place but I feel like I'm starting to grow apart from them. I feel so alone and its all my fault. Thanks to me, struggling with meeting new people, keep eye contact, talk until you're comfortable with them etc. There are times where I just feel like I rather be alone than to talk to people. But why do I feel like this? I don't want to be by myself but sometimes I can't help but to only have myself as company.

There are times I know the other person just doesn't want to talk to me because I bring up generic topics to talk about (how are you doing? Any plans for today? What are you up to now?). But I don't know how to talk... I've been like this for years now. 

I don't want to stay alone because I end up overthinking everything and think the world hates me. Why the fuck am I like this? I need help!"
I planned a get together to see my friends one last time and no one came,"I didn’t tell them why I wanted to hang out and I planned it a while ago so it wasn’t last minute. Everyone flaked. I try not to be a downer when they’re around. I honestly don’t think anyone knows how depressed I’ve been these past few months and I don’t know how to tell anyone. I had a therapist who I’d get all this stuff out to but she left so I haven’t been able to talk to anyone about how hopeless and useless I’ve felt in almost 7 months. I don’t feel like it’s fair to dump it all on my friends and even if I felt I could go to them I don’t know how to tell them.
I’ve planned to jump from a bridge on Monday January 21st. It’ll been cold enough that if I manage to survive the fall I’ll freeze to death in the river. Tomorrow I’m gonna watch the lunar eclipse alone. I’ve always liked stargazing.
Sorry, I have no one to talk to so I’m just shouting into the internet void again. If you’re reading, thank you for giving me a couple minutes of your time 

EDIT: I’m sorry if I’m not responding to some people. I really appreciate your support and I’m trying to but for some reason I get a notification of a comment but it doesn’t appear in the tread. I’m really sorry I promise I’m not trying to be ungrateful or anything 

EDIT 2: I really appreciate the support from all of you. I didn’t think this would get so many responses and I’m really sorry if I don’t respond to some because it’s a tad overwhelming. I did read every one and I just want thank you guys for listening to me for a minute. "
Tired,Anyone else just feel extremely tired all the time? Like not wanting to do anything but stay in bed or waste time doing something meaningless?
Ever wake up every morning and you want to die?,"My depression as constantly began to get worse and worse. It’s been years since my last suicide attempt and I was supposed to try again this year. But then I got a girlfriend, she loves for me cares for me and makes me feel great when we are together. But, even thought we live together I hardly get to see her because she works days and I work graveyard, so when I get home she has to leave. I see here a total of maybe 10 hours a work week. And all those hours I’m away I feel like nothing has changed since before I met her. I go into such deep depressions that I feel like my heart could stop at any moment (wouldn’t be opposed to it anyway). I’m scared to die, but I’m not scared of being dead. The only time I’m happy without her is if I smoke and that last a couple hours tops. I don’t know why I’m so sad. Plenty of people have it way worse then me and somehow they are happy without effort. I have it made, good job, love of my life, a place to lay me head at the end of the night. Sadness overwhelms me almost daily, I’ve tried everything I can. I wake up ever morning and wish I hadn’t. Living seems like an endless battle that I can’t win.  Everyone thinks I’m joking when I tell them I want to die, but honestly that’s the most truthful thing to ever leave my mouth. Anyone else have the same problem?"
I think I have decided to do it.,"I have thought about suicide constantly for many years. My entire life, I have felt as though I have been genuinely cursed. Truly terrible things seem to happen to me with unusual frequency and I can't help but see that this is not how life is supposed to be. I can't even talk about my biggest problems, but a combination of mental illness, constant weight issues, being an outcast from society and seeing no hope for the future all contribute to these feelings.  I have tried holding out, I have tried soldiering on and I have done it for many years, but I live in a constant state of fear and suffering. My sister, who is probably the person I love most in the world, is one of the few reasons I have held on, because I felt that taking my life would hurt her. And I still believe that it would. But I have been thinking about how we are getting older, and it is not fair for me to rely on her as we become adults. She deserves to go have a good life as someone as truly beautiful and kind as she is deserves and if she is constantly hanging out with me, how can she ever have that? Honestly, I can't fight this anymore. I have seen therapists and taken antidepressants, but the only thing that helps me at all is abusing my anti anxiety medicine so I can sleep. I just really can't take it anymore and have stopped thinking about IF I should do it and more about how I should do it in a way that would least inconvenience the people I love the most. I'm thinking about going into the woods and just lying down and freezing to death or jumping in front of a train. I don't know why I am posting this, but I just needed to get this off my chest before I do it. Thank you for your time and I genuinely pray you all have lives better than mine."
1 hour to go,"I've already made up my mind, nobody can talk me out of it so don't even bother with 'dont do it', please
I always wanted to feed ducks, never did. I'm partially housebound thanks to agoraphobia and if the ducks touch me I'd have a panic attacks thanks to OCD, so I have never fed ducks.

This is just one of the things I never did with my life, I've wasted it and spent the first 6 years being happy then the rest feeling unhappy wishing I relived those years. 

I don't have a gun so my death will be painful as hell but its my only method

EDIT: I did it, but my instincts are running wild telling me to tell my parents, what do I say to them

EDIT 2: It failed, I'm in the hospital but I won't be admitted to the ward because of my agoraphobia, I wouldn't be able to handle it.

UPDATE
I tried to reply to you all while in the emergency room but I had no service, here's a bit of information on what happened.
I had a champagne flute full of disinfectant, however I fucked up. Turns out I was too confident that cleaning chemicals are always toxic, turns out the disinfectant was citric acid based.
I tried to kill myself with citric acid.
I didn't even read the back, I'm so fucking stupid. Ny organs aren't even partially affected.
I was not admitted to the psych ward, but I nearly was. My psychiatrist understood that due to my agoraphobia it would not help to admit me, so he vouched for my discharge, which I was discharged 12 hours after I went to the hospital

I had an ECG to check my heart, where I had to take off my shirt, my dad saw my self harm scars. (My mum already knew about it but my dad didn't, he has not mentioned it yet.)"
I’m 15 and honestly just have no will to live anymore,"It’s like... one good thing happens and then a million shitty things happen and I can’t seem to get one moment where I am ever truly happy. Then I’m constantly anxious and paranoid, plus I’ve been hallucinating. 
What’s the point? The only reason I’ve stayed here past 12 years old is because of my sister and now she’s a little brat who hates me because all I do is stay in bed. My parents don’t say it but I know they are disappointed and wish I was a better child. 
All I have is my girlfriend who I can’t even say is my gf because her fucking ex might swoop her off her feet again before I get the chance to even kiss her for the first time. 
I can’t open up to anyone close to me because to me it’s not opening up it’s just dumping all my problems on them. 
I just wish I didn’t fucking exist, that people didn’t care about me and that I could die, or start self-harming in peace again. I mean I did relapse but I can’t even relapse on my wrist so I doesn’t hurt as bad I have to cut on my thighs. 
I just want it to be over. All of it. My depression, my anxiety, my fucking undiagnosed shit, my family problems, I wish that my ex had never molested me. I just want it to be over and I can’t talk to anyone but internet strangers about it. I’m pathetic."
After 20 years of life no one knows me well enough to give me a eulogy,"You ever sit around just picturing your funeral? Hell I don’t even want a funeral. No one cared enough to get to know me when I was alive and they surely won’t care when I’m dead. I wish that could actually be arranged. To just get thrown into the ground without a word being said. Cause that’s how I lived my life, no one wanted me around alive and I don’t want them around when I’m dying."
I just wish I'd get cancer or some incurable illness,"Life just isn't worth living. When you've got the unfortunate mix of being unattractive, irratible, and dumb you realize how shitty the world is. I really want to kill myself but I love some people and would feel awful if my suicide effected them, even if it only affects them for a year at most. I just wish I'd get cancer and die so people could say it was bad luck instead.

I don't know. Maybe I should start smoking cigarettes or something. I wonder how many I'll have to smoke to get the desired results"
My name is John,"I don't know what I'm looking for here. I just want to be heard. I'm posting this on my actual account because I want people to know who I am.

Every day I wake up to a physical pain in my chest. It's the kind of pain that can't be rid of through Aspirin or ibuprofen or Tylenol, it's much like hunger, except it can't be satiated. Every day I wake up and feel it. But I go to class; I do homework; I smile; I laugh; all because that's what people are supposed to do. I'm supposed to get dressed and walk out of my apartment every day prepared to take on the world. But I can't. I'm tired. I'm sick of it all. I'm sick of being alone. 

Every day I cry. Most of the time it's when my roommate is gone, but sometimes I don't have that luxury. I work at my school's library, and the other day I was assigned to sort books. While I was working, I lost it. I had to sit in the bathroom for 10 minutes and try to collect myself. When I finally left, I stared at the same title for 30 minutes, all while contemplating walking out of my shift and ending it.

I just don't know what to do. I've never had a girlfriend, and I was a virgin up until 21 til I finally had enough and paid a prostitute. It was shit. I couldn't perform because I was drunk, and she was obviously just in it for the money. No passion whatsoever. All through high school I watched my friends get in relationships. I listened to them talk about relationships and hung out with them and their girlfriends. I enjoyed their company, I considered them friends, but every day something inside of me collapsed a little.

Then, finally, at 22 I met a girl through Tinder. I really really REALLY enjoyed talking to her. We talked for like two weeks before we met up, and it was the first time I've been happy in years. Every day I was checking my phone multiple times a minute. Some people say that a relationship won't fill the hole inside of you, but after that night I can say with certainty that it is exactly what is missing in my life. I want someone to want me and enjoy my company. 

When we met up, I thought things went well. We hooked up. The sex was good - really fucking good - but what made me the happiest was the fact that someone liked me enough to do it with me. But a day later she messaged me and told me that she found me too awkward to talk to and that we shouldn't talk to each other any more. Now, this was a woman who has slept with nine other guys, some of whom were one night stands, and kept in touch with *every* other one of them. This was a woman who dated a man who could only eat pizza, burgers, and french fries, because he had such a bad case of anxiety that any other foods would cause him to break down.

But *I* was too awkward to keep in touch with. *I* was too much work. 

And that broke me. Whatever it was inside of me that had been giving all my life finally collapsed. For years, I've tried to socialize. I've tried clubs, I've tried jobs, I've tried talking to people around me in classes, and it hasn't done anything. I thought maybe it was because I wasn't physically attractive, but then I got in shape and it changed nothing. So I gained a little weight back, and then I met her. I had a chance with a girl. I thought she liked talking to me as I liked talking to her. But I was wrong.

Through her I discovered the truth; I'm fundamentally flawed. I can't socialize. I'm not attractive. There is *nothing* physically impressive about me. I have no hobbies. I'm boring as shit. I'm awkward. I have no redeeming qualities *at all*. I don't know what to do about it either. I tried a number of hobbies. Skateboarding, puzzles, reading, television, exercise, drawing, instruments, etc. It all bored the shit out of me. I had *zero* fun. 

I lie to everyone. I tell people I got laid in high school. I tell them I had a good size friend group. The truth is, I've never had more than a couple friends at a time, and I've never been in a relationship. Every day this eats me up. Every day I wake up, I'm disappointed that I didn't fucking die in my sleep."
After a week long disappearance and a gun purchase I finally admitted myself into the psych ward.,And for the first time in over a decade I am getting the help I have needed. It's never too late.
In few hours it’s over,"Shortly after midnight (between 2:00-3:00) I’m going to hang myself. I refused to live a hopeless, pathetic and miserable life anymore. I’ve written a very short note to my mother. I’m terrified but I must do it.

Fuck you cruel world!

Edit: thank you for the positive comments but I’m domed. Believe me I badly want to live and in the past 4 years I did everything I could to feel better but I don’t belong in this world. Where I’m it’s 23:00 so I’ve 3-4 hours left. Only reason I will wait for few hours is so I can do it when everyone is asleep. I don’t want to be interrupted."
The only thing keeping me from killing myself is my wife and daughter. I am beginning to resent them for it.,"I've talked to two therapist. They both encourage me to get a divorce (after a LOT of therapy). The issue is, I really think I can't handle the stress of a divorce. 

I love my daughter very much, and I want to see her grow up. However, I feel like a fucking robot that can't make anyone happy. I work harder and people ask for more of me.

Both my parents have died in the past year and my last words to both were ""fuck you"" (one deservedly, one not so much). I came from very humble beginnings and worked myself into management and after my dad died my work went to shit and I am getting canned. 

I just don't want to do any of this anymore, but I do becauee I have to. Not sure what I need or if I need anything from here, but it feels better to type it. 8 times I have had serious thoughts about suicide this year, everytime I think of my daughter and realize I can't.

The only thingnthatbreally help is smoking shittons of weed which, of course, leaves my wife dissappointed in me (I have been approved by a physician and live in an legal state. 

My younger brother is in jail and the whole system isndesigned tontake money from families and with me losing my job, it is expenaive to even talk to him.

Our world is cruel and I don't want to live in it.

I spent 10 years in the Army and did 3 tours in a Combat Arms job. I've earned real medals (bronze star with a V, ARCOM with a V) for actions in combat. No one gives a shit. No one cutsbyou any slack for killing for college money. For digging up IEDs for a poverty wage. For losing friends. 

And all I am is a disposable piece in this machine, school, work, the government, family. It's all just people in a line waiting for their piece of me.All this world and the people in it want is to take. I have nothing left to give. I am dead inside. 

I'll wake up and do it again tomorrow. I will wake up, get the babybready while my wife takes a shower. Drop off the baby. And gontrain my replacement and apply for jobs that will reject my resume. I'll home and work on my MBA homework so I can go hate my life for hopefully more money down the road. Fuck this all."
My dad hanged himself today,"I'm in bed now and I just need to write down my thoughts. He was a difficult man, in the sense that his upbringing didn't allow him to believe that he was worthy of love if he wasn't succesful. I just found out that for the past year he'd been covering up the fact that his second company (he lost the first one, worth millions, during the housing crisis) was failing. He'd been getting in with some bad people to stay afloat apparently and he was getting in debt with them too. He just took his life, leaving only a note saying he had a lot of debt and he couldn't deal with it anymore. Not so much as a 'I love all of you'.

My mother is devastated. Me and my sister are just trying to be there for her...

But to be honest. I've also been struggling with depression my entire life. Me and my dad were very much alike and related so much on that level. I thought he was the strongest person I knew. He was literally my hero.

And now I'm just wondering what this all means. How could he have done this? My mom is feeling guilty about being angry but... we are all literally heading for immanent financial ruin. We will lose everything. He was the breadwinner.

I just wish he would have talked to us. I miss him so much already. He was my best friend. Where do I go from here..."
Planned to kill myself today,"January and February was the darkest time in my life and I decided that 18 April would be the most suitable day to end my life. Just like the stupid human I am, I made reminders on my calendar to remind me that it's time. The second reminder was to make an appointment with a psychiatrist for my family. Everything was sorted. 
But when the day came, I don't even remember what I had planned until I saw the reminder. 
Life gets better, it will go downhill too but only to rise again. This gave me hope to continue. Maybe I'll be stronger the next time a wave of sadness hits me."
My life is just a never ending cycle of bullshit,I'm so fucking sick of it. Same shit different day. Change never comes no matter how hard I try. Really considering just ending it all since there is no way out.
My cousin was killed by his girlfriend about a year ago.,"My cousin was killed by his girlfriend about a year ago. They were having a fight; she was angry and vindictive like always, they were screaming and arguing at each other. He was fed up with her shit and finally decided to leave her. She called the cops. He got in his car to leave. ""He's got a gun"" she screams. My cousin puts his hands up. Cops think he's raising a gun and they shoot him 14 times. My cousin is left in a semi comatose state. Over the next couple of weeks the hospital sends us updates of his condition; they claim he's improving rapidly and regaining neural and motor functions. It was all lies, He died in the hospital one week later. The Cops claim he was standing when he pointed a gun at them and they acted in self defense. More lies. The ballistics show that he was sitting in the car when he was shot.  For the longest time I never accepted that he was dead, It just never seemed real to me and For the longest time I have been suppressing my emotions but recently this horrible feeling of dread has been seeping over me. The thought of death or dying sends me into a state of intense anxiety complete with Panic attacks. I cant take this anymore; every time it happens I just think over and over again ""Why me""  ""Why did things have to be like this"" ""I wish i never even had these thoughts"" I don't want to feel like this anymore. This is no way to live I shouldn't have to feel like this every day. I want to Die. But i cant. It would cause my family too much grief and they would never understand why i did it. The Last thing I want to do is to spread grief to my family. I wish I had never of been born so I would never have to experience these feelings.
(I apologize for this rambling wall of text, I am an awful writer)"
I tried hanging myself but feel happier,"i tried hanging myself a couple hours ago. i had planned it all day. i even asked for help for the first time ever. but still up until the hanging i felt hopeless. 
it didn’t work because i hung it too low and i was able to push myself out before i could breath my last breath. 
i took down the rope, got into bed, finished homework due today i guess and here i am. 
i feel happy though. not happy to be alive but just happy that a part of me is still fighting to live. i’m not sure how long this feeling will last but i do still intend on getting help because i’m worried that one day, when i’m not ready for it, i’ll just give up. 
i’m not sure where to go from here or how to hide the burning red mark across my neck but i do know i’m the happiest i’ve been in a while."
I can't wake up at 8am and work until 6pm every day until I'm 70. I just can't.,I wasn't made for this society. I'm too weak. I can't keep doing this forever. I feel so drained.
I think people who die are lucky,"they don’t have to suffer every fucking day, they don’t have to be reminded of how worthless they are. they are at peace.

I wish I could be at peace. I’m completely worthless. I deserve to die. I really do. I have notjing to offer all I do is suffer and make others suffer and I wish I was dead I can’t take it anymore

please make it stop"
