I want to kill myself. I want to die. NSFW,"**trigger warning - talk of sexual and physical abuse.There is no TL DR, I need to vent. I've never told anyone the entirety of my life. I never wrote down how I felt. I want to see if it helps.**

&#x200B;

I was physically abused by my father. I remember one time he slammed/pushed the kitchen table into my chest while I was eating dinner. It pressed my chair up against the wall, then pushed all the air out of my chest. I remember getting tunnel vision and hitting the floor limp, as the table was pulled away.

When I tried to get up, while on hands and knees, I was kicked in my stomach by him. I don't remember anything other than being on the couch and my mom leaving him after that with me and my 2 brothers. I was 8. This is ONE story.

&#x200B;

My great grandfather used to call me worthless and emotionally abuse me because of my ethnicity. Until I was in my 20's I was reminded daily about how worthless I was over something I had no control over. He basically stepped in as the father figure. I would spend my summers in Southern California helping him super his apartments until I was about 17.

&#x200B;

I have never told anyone this, I was also sexual abused.

&#x200B;

I have never told anyone this, I was raped.

&#x200B;

To me, those are two separate things. When the abuse started, I physically enjoyed it. Had no idea. Then I was brutally sodomized. Then I grew up just a little and that's when I started to hate distrust and not like anyone. I built a fake smile. I built an auto pilot response for everyday things. I don't think. When I can, I do what I can to stop.

&#x200B;

From the ages of 9, to about 14 I was fucking raped weekly by a boy 7 years older(We'll call the fat ugly rapist FMC). I felt like shit because at the start I liked it. I didn't know what was happening to me, I just felt. By the time I was 12, I started to feel disgusted. By 14, I fucking hated everyone. I don't care to discuss the last time he abused me but I will say I don't think he EVER put himself in the position he was in. He left me alone at that point.

By the time I was 18, I was wrapping up making money by taking it from adults to beat the shit out of under age people I went to school with (gang related and they didn't want to get in trouble, and hell whats the worst that could happen to me if I get caught? I was a minor), they all deserved \*this is just how I felt at the time\* it and it was my only outlet. It was shit like, kids stealing and the owners wanting revenge cause a family member seen them with the stolen property at school. Or someones dad wanted me to scare the shit out of the daughters boyfriend. Shit like like that. The last time I did something like this for example - Some kid who was a senior ( over 18 at the time )had his stereo stolen. He gave me $50 to beat the shit out of the kid who did it ( 16yo ). He reminded me of the boy who raped me. When I punched that kid, all I could see was that fat piece of shit FMC. When he was on the ground, in the fencing position, I drug and slammed him around by is hair. Into the side walk. I picked him off the ground, while he was dead weight- and rubbed his head in the top of a chain link fence. I was expelled and arrested for assault. I tested out of High school. I have never ever been violent with ANYONE since then. All the way till now and I'm 36.

During my time in School, seventh through high school, I hated everyone. Fuck em. I had only 1 real friend and I had one crush on a girl. One. It lasted no less than 2 weeks of fantasizing before FMC learned about it. He didn't like it. He told David my best friend at the time (he had no idea FMC was fucking raping me and new him as a friend of my family) that I had made out with her. He knew David liked her. David, pissed from hearing this, asked Christian. Of course she denied it. It never happened, it wasn't true. I was now known as a Liar. She went to church and school with me. I was 13 at the time, so from grade school right on through to high school, if I went to church with you or school, I was a liar. So the one girl I've ever liked now labeled me and to everyone else a liar. My best friend, no longer, because now I'm a liar. This was what happened the first time I ever told another person I had FEELINGS twards someone else. One little bitty crush. Now - No social life. Destroyed. Home life also. Behind the scenes is a literal fucking hell. I liked girls. was being raped by a 300lb+ fat fucking boy. I hated FMC, after my last altercation with him I was close to or at 15. About a year goes by. No girls look at me. Small town. I don't like them, because they hate me, I lie about making out with em. I wanted to have sex though. To be clear, I wanted to fuck. I had been fucked. I wanted to have joy... Just once... So I had a plan. When I was around 16, doing the summer Super Job for my Grandfather, I paid a prostitute for my first sexual encounter that mattered because I wanted to know what sex was like with a woman. When I got back to Northern California after the summer job at gramps, I told my older brother and he called me a liar. I never told him anything personal up until recently because of that. now my family thinks I'm a liar, and hates me to.

&#x200B;

So at this point I am 18 and I fucking hate everyone. My dad also starts developing a mental disorder. He slowly is becoming mentally disabled. I figured, fuck him. Some karma.

&#x200B;

I decide to move out. My cousin, she moves in with me. I was growing weed at the time. Played video games. Didn't think.

She and I connected. She was the first person I ever felt ANY affection for. She didn't want to use me. She didn't want hurt me. She wanted to know why I was hurt. My head at this point of my life is just so fucked I think/confuse that with her romantically liking me. I did my best to sleep with her. She out of guilt, w/e let me. She knew nothing about my past for the most part and we did not grow up together.

I knew her from the age of 1-5, then met her again when she was 17. I, out of the fucked up need to want to be wanted by the ONLY person I actually had confused feelings for manipulated or talked or w/e my cousin into an incestuous relationship. I wanted to kill myself. I kicked her out of the apt. She moved in with my older brother and had a sexual relationship with him for about 3 years. I felt I was the one that fucked her in the head enough to do that.

&#x200B;

I was going to kill myself.

&#x200B;

My grandmother, the great grandfathers daughter had bad arthritis. She was a chef. So I learned to cook and take care of her. I learned that I enjoyed people eating and liking my cooking. This was the first time I felt ANY joy from someone else. People. My grandmother died when I was around 26. she killed her self, the pain was to much. I hate saying this but, I didn't really care. I love her... but I didn't care. At least she wasn't in pain....

&#x200B;

I felt nothing for anyone for a good period of time. No love, no hate.

&#x200B;

So until about the age of 27, I got hit on multiple times. I am not unattractive I guess. I was in 8 physical relationships in my twenties. 2 I sorta developed feelings for. I never asked any of them out. I never once told them I loved them. I never lied to them or cheated. They asked me out, they persude me.  Sex was a chore. I love sex in my head. I love to  masturbate . Watch a healthy amount of porn. But actually having sex..... ugh, I would rather  masturbate  tbh. Everything sex reminded me of two things, the only person I care for and still love like a sister now, my cousin; which makes me sick to my stomach because I felt I manipulated her into doing something horrible, and being raped in the ass by a big fat piece of shit.

With porn at least I can choose any nice loving thing that I want. I like scenes where you can tell there really into each other...  And I don't have to think.

\`

At 28 I was in love for the first time.  Met her at work.

&#x200B;

She started everything. I mean EVERYTHING. She broke up with her boyfriend AT work. Asked me out in front of him the next week. For 6 months she was in a relationship with me, for 6 months I thought we were together. For 6 months her and her old boyfriend who she was in a relationship with for more than 5 years at this point, used me to further his cuckold fantasy. When I found him literally in the closet one night in MY FUCKING APARTMENT that she snuck him into that day at what time I DON'T FUCKING KNOW, jacking off to me fucking his girlfriend who I thought was with me, I flipped out. My life is insane, WTF IS THIS SHIT. Melony thought I was going to kill them. I might've. She left, both naked, with my blanket, peeling out of the parking lot. I quit that job the next day.

&#x200B;

I want to kill myself. Have it planned.

&#x200B;

My father develops a bad health issue, compounded with his now mental age of around 7, his health his slipping. fast.

&#x200B;

I move in with him, the state pays for me to take care of him. I do nothing but play video games and smoke weed. I'm waiting. I tell myself, ""When he dies. I go to.""

&#x200B;

At 31, I leave the house maybe once a month. My older brother decides he wants to reach out cause I'm a ""little"" closed off. At the age of 32 He includes me in his hobby. At 34, I turned it into what might now be a carrier. I still take care of my father. I am not so sad anymore.

&#x200B;

I'm 36, I'm doing well at the job I can make into a career. I met someone. Another Co worker. And for the first time, no confusion, I have a full blown crush as an adult. She's nothing special to look at. Not ugly in any way. But my god the personality, her choice in music, so many things in common. Thinking about her makes me smile. She initiated the flirting. We chatted for hours and hours for weeks. This did not happen over night. She has been there for 7 months at this point, and about 2 attached at my hip when she had free time. Also the subjects she would bring up. She was very much flirting. So of course I tell her. No way can I have any regrets.

&#x200B;

So today I come into work and she makes no eye contact and shuts her office door. Witch is not normal. I ask her if I can talk to her about something later at lunch. We get ice cream some times together so I figured that would be the time. She just avoided and left me standing there after I asked if we could talk later. Didn't answer. So I asked her at the end of the day. Told her how I felt, and the last thing that I wanted was for her to feel weird at work.  Then she told me she has some one, and it's ""complicated"". I am almost positive, she likes another coworker. I see them text each other all the time. Didn't think anything of it till today. The thing is, yesterday I mentioned I might ask her out the next day joking around when I seen the other co worker in the parking lot, the one I think she likes. He doesn't work in the building with us. Hadn't seen or talked to him at all today. He Laughed when he seen me today at the end of the day when we clocked out. Pretty sure he told her the day before, it made so much sense after I thought about it. The way she avoided me.

&#x200B;

She wants nothing to do with me. Went from conversations, her staring at me when she thought I wasn't looking, to her actively avoiding me at work. In just one day. I went from feeling again. I went from finally feeling like I can open up to someone. I even entertained being normal once. I felt again for someone else ONCE MORE. This time it wasn't misplaced I told myself. I should have listened to myself when I told me not to even think like that. because it wont happen. It won't. Never in my life will I ever find someone that wants me for me, not to use me. Never in my life will I want the person that does. I will not be happy.

All I want for my coworker is to be happy. I don't think in any way that anything on both parts was malicious. I think it's just terrible timing. Or this is hell.

&#x200B;

I think I'm done. Thinking about headed to sleep.  I will check tomorrow to see what people have to say if anything... All I know is, I got to feel for once, and what I felt was what people do normally. I couldn't even once in my life have one thing ONE fucking thing normal. I can't be happy I guess. Fuck this world.

UPDATE- I made it home from work. While I was at work I felt comfortable enough to talk a LITTLE to a co - worker. Gave him a little perspective and the day was less award than I thought it would be. he helped just by listening. That being said, she still locked herself in her office all day so there was at least not to much awkwardness. Didn't have lunch with everyone witch is very unusual for me and left a little early so we didn't have to leave together. I just want her to feel comfortable at work. It's not her fault at all. Also everyone at work knows. Everyone including both my bosses thought the same as I did about my co-workers interest in me. One even asked the girl I liked I guess, ""how long do you think it will take before you two hook up?"". So I guess my mind wasn't playing tricks on me. Just wish she didn't play games. All I know is I can't choose how I feel and I bet she's no different. So I am just going to be myself for right now. Do what I do. Don't think, just do. But fuck, I'm still so fucking tired of being nothing, feeling nothing. At least today I felt like shit =) I mean, that at least is something...  


Another thing I will add is my older brother and I have different fathers and my cousin is not a blood relative of his. "
"Everyone wants YOU to do something, but noone wants to help YOU in person.","That's how it is. It's all a lie, all pretending, all fake.

&#x200B;

If you'll ever go to a psychiatrist...

If you'll ever go to a therapist...

If you'll ever go to a psychologist...

Or even if you ever come across some random on the internet, or in real life...

&#x200B;

They are all smart asses, all knowing, but not even one of them will ever give you a hand. It's like coaching. Giving worthless advice.

&#x200B;

Poor? Get a job.

Sad? Find happiness.

Lonely? Meet people.

&#x200B;

Wow, really? Wow, thank you so much, I didn't know it's that simple! Wow! Thank you my savior. I'll be rich now, happy, and have plenty of friends. I was so stupid, thank you for showing me the way.

&#x200B;

That's the point, that's the key. 32 fucking years, and you dare to say me, do something?!

&#x200B;

""A drowning man will clutch at a straw"", but you first need to give them one.

A lot of people could be saved if they had ANYONE by their side, cut the bullshit, and chit chat. If you're not here with me, then just fuck off. I don't need no imaginary fake friends. I wouldn't mind friends with benefits though, at least there would be benefits, obviously."
AM I THE ONLY ONE WHOSE NOT EXCITED FOR UPCOMING DECADE??,"I really feels so sad. I tried to do some hobbies and play games. 

I feel so tired hanging out with people. Reasons why I don’t want to celebrate Christmas and New Year anymore. For me, it feels like bullsh*t faking your HAPPINESS."
Im Alive. But I'm not Living.,"I'm present. 
I'm physically here.
And that's where it ends."
Got fired for taking a dump,"I worked at health department on contract, I have a bad stomach so every morning after thumbprint and attendance being confirmed I ran to the bathroom to take a dump. Everyone knows because I went every morning for a year included my boss, but on monday my boss had a very bad mood and after I went back to the office room he was like ' where were you huh? ' and I said taking a dump, and then he said well you didn't asked for my permission ( I usually didn't but there was never a problem) and I said I don't see a issue here because go every morning, he got mad because I answered back and fired me, now I have rely on saving during this quarantine.

Country: Malaysia

Edit: 2 week ago I walked in  on him cheating on his wife with his assistant. Maybe he saw me as threat."
"I asked last Saturday if ""Anyone there"" ? You answered. Thank you. I was half way through my suicide attempt.","I was on this site last week and need someone that I didn't know.  I'm not doing well lately. I have a toxic abusive relationship, I cannot find a shrink to save my life (Literally. ha), I'm going through a divorce, my soul mate died (dog), I'm having to move states, find work, find a new home, and am living with my parents as of my psychiatric hospital release the day before yesterday.

I had been half way through, and had 2 methods essentially.  I took a medication to make it so I wasn't scared to do it. In the closet I was in, I had my phone, I'd already filled out my suicide note, and dictated in my legal will and burial details what needed to be done. I wanted to go forward.  I can't now, but think if it were again ... I would have not called for help but just let one of the methods run its course and go to sleep. I wouldn't wake up again. I am still ok with that idea.

I stood in the closet and had a fraction of a second that I was sobbing trying to pump myself up and asked if anyone was here.  It didn't save my life, but it gave me a second to think that wasn't thinking about the problem, it was writing and reading. I put \*\*\* \*\*\* down. I called my husband (STBX) and was taken by ambulance.  I was put in a hospital for a 5 day week and am now at my parents house. Everything is locked up, I have no access to anything. I don't have my car. I'm safe.

but Thank you. I wanted to tell someone what happened. I need to feel less confused about it and why or if I'm a risk, or if I'm being dramatic. I can't tell. But I can't talk about it at home. I'm sad and embarrassed to be here.  


Edited to remove specific methods of suicide attempt."
"Please feel free to keep scrolling. Find happiness and peace, my friends.","I think I'm finally ready. I've hurt too many people and I want it to stop. I'm a monster. I just want to keep everyone safe, but I'm covered in the blood of those I love. I know this will probably be ignored, but I just want to keep people safe. I want to finally eliminate the problem. the reason I'm posting here is because of a promise I made. But if this doesn't take...I think I'm ready. Normally I wouldn't say so much, but I don't know what else I could say. I've attempted suicide a few times and failed, and contemplated since i was very little, so I know I can do it right this time. I'm sorry that I'm like this.

If you read this, feel free to keep scrolling. Please don't be like me. I just want you to know that you are loved, you are valid, you deserve the space you take up, and your feelings matter. They are not something to ignore or be tossed away. You deserve to be heard. I love you and cherish you no matter who you are or where you are from or what you've been through. Please try to take care of yourself. Do the small things, even if you don't feel much like them. Take a walk, drink some tea, read a book, find peace in the rain, and smiles in the sunshine. Be careful where you let your mind trod, and please reach out if you need help. I love you, you are not alone in your feelings, and you can make it through this. Do not follow me, please, for I walk a lonely road. Please take care of yourself."
I told my mom for the first time that I tried to commit suicide,"She yelled at me, then I told her that I'm sure I have depression, she doesn't believe and I can't stop crying."
I tried to hang myself and I’m not handling it well,"Yesterday I tried to hang myself from a bridge with a belt and when I jumped I instantly regretted it. I fought with all my strength to hold on to the rail, but the belt was chocking me. I tried screaming for help but my voice was too hoarse for anyone to hear me. Eventually my arms gave out and I started to dangle and suffocate. I saw people in my life that had died and I saw all the great memories of my life flash before my eyes. Right as I was about to “go out” my leg began to swing up and reached a ledge. It was my last strength. I pulled myself up with my remaining core strength and leg strength so that I was parallel with the bridge. This gave me room to breath again. I swung my arm up and around the rail so that I could attempt to take the belt off and I knew I only had one shot at this. I was successful, but my body gave out after the belt was free and I dropped into the water. The next day (or today) I have been reliving the moments that seemed to be my final moments and other PTSD symptoms and I’m not sure how I can deal with it. Anyone have anything that could help?"
"i really wanna hang myself rn. Im not going to do it, but i really want to","im not feeling good this morning so im cutting up my leg rn ): but it happens u know


sometimes things suck and u gotta cutt

(i already know cutting is bad so please dont mindlessly spew taht out in the comments. i also know how to take care of my cuts)

~~~~~~~

*edit: hey, i noticed the comments have been getting spicy and i would like to put my thoughts here instead of repeating them in the comments-

please DONT comment something along the lines of ""i care about you"" or ""i love you"". we are strangers on the internet. you dont know me, i dont know you, we dont know them. that means nothing to the receiving end.

please DO share your own experiences and how they may compare or contrast! i and others would much rather like to hear that we are not alone. theres also no harm in wishing others well rather than telling them things WILL get well.


also, please dont be toxic to each other. i can handle toxic comments, but idk other people's headspaces right now and id rather this post be a chill space than a nasty one. 

thank you.*"
I would give everything to be straight,"I'd give my soul to the devil to be straight. I wish i was straight more than anything. I want to die. I want to fucking kill myself and never breathe again. 

No one understands what it's like to be gay. How shit, unfortunate and depression it really is. You're dating pool is nearly non existent so you most likely will never find someone, even if you do find someone you cannot ever create a real, traditional, biological family with them. Before any of this, you have to deal with homophobia, realizing you're a worthless dissapointment to your parents, that you betrayed them. 

This is how i feel every single day of my worthless life. Every single day. I'm sick of it. I want to kill myself."
"People say this feeling is temporary and it will pass, but I have never experienced sustained happiness. I have always been depressed - my entire life.","It frustrates me that people think they have the right to morally press me into staying away from suicidal thought and faking enjoyment for life.

I will not kill myself, because of the natural human fear of death. That doesn’t mean I’m happy to be here or that I ever have been. 23 years of being depressed angry and fucked up and no it isn’t ever going to get any better I fucking know it won’t. I don’t even want to live a happy lie.

I fucking hate my selfish pathetic parents for putting me on this earth. I did not ask to participate in life. I did not consent to be effectively forced into wage slavery and then eventually the terrifying experience of death.

Off to get drunk now to blunt the sharpness of these feelings

EDIT: Getting drunk was 10000% the right decision I actually feel vaguely happy wtf is this magic"
i almost killed myself,"but i didn’t. 

yay? i guess?

i almost drove off the cliff. i was so close to doing it. but i sat in my car and i screamed, 

“JUST GO HOME. JUST GO HOME. JUST GO HOME. JUST GO HOME.”

until i made it home. and then i sat in my driveway and sobbed.

when i went inside, i broke down in front of my roommates and had a severe panic attack and my roommate just rubbed my back and helped me breath.

the next day, my best friend took me out to eat. i told her i almost did it. and she said “i could tell a few days before that you were off. and i didn’t say anything. i’m sorry, i should have. i didn’t want you to feel like i was smothering you.” 

but it just meant a lot that she noticed and that i could talk to her about it. 

i have a great support system, but i’m just living with this mental illness. it hurts. my life is so good, but i’m just sick."
I’m sorry I wasn’t strong enough to stay until the end. Bye,[update](https://www.reddit.com/r/SuicideWatch/comments/fnbhgx/im_alive/?utm_source=share&utm_medium=ios_app&utm_name=iossmf)
I wish someone would shoot me to death.,"This morning my dad went on a rant about how people who don't add anything to society should die. All I could think about is how that's just me. I'm useless. I'm unwanted. I might not be a convicted criminal, but I'm definitely never going to be useful to society. 

I don't agree with him in any other case, but in my case... Yeah. I should be killed. 

I can't get enough courage to do it myself, but I still very much want it to happen. 

I can't see a day when I'll not be like this. Useless and suicidal. These are just two things that I'm meant to be. I don't want to be them, but here I am. 

Kill me please."
